Date,Sender,Message
2024-12-06 11:59:23+00:00,-1001156495705,https://youtu.be/5bIg9zX7KB8
2024-12-06 09:29:32+00:00,-1001156495705,"RECOMMENDATION ALERT ðŸ””

Stock Name: Narayana Hrudayalaya Ltd
Symbol: NH
Rating: Buy ðŸŸ¢
CMP: â‚¹1331
Stop loss: â‚¹1275
Target: 1480
Duration: 5-10 Days
Trade Date: 06-12-2024
Trade Type: Short-Term Trade
Name of RA: Om Mehra

Disclaimer: https://sam-co.in/6j/ Samco Securities Ltd"
2024-12-06 07:10:17+00:00,-1001156495705,Trail SL to 918 (CMP 965)
2024-12-06 06:12:38+00:00,-1001156495705,"RECOMMENDATION ALERT ðŸ””

Stock Name: Affle India Ltd
Symbol: AFFLE
Rating: Buy ðŸŸ¢
CMP: â‚¹1780
Stop loss: â‚¹1425
Duration: 6 Months
Trade Date: 06-12-2024
Trade Type: Momentum Pick

Note: Since we base our strategy on earnings and momentum, predicting the target price might lead to early exits. So, we will update the exit price as soon as the stock loses its momentum or becomes technically weak. Until then enjoy the ride. The ideal holding period for this call is six months.

Name of RA: T Manish

Disclaimer: https://sam-co.in/6j/ Samco Securities Ltd"
2024-12-06 05:52:41+00:00,-1001156495705,"RECOMMENDATION ALERT ðŸ””

Stock Name: BLS International Services Ltd
Symbol: BLS
Rating: Buy ðŸŸ¢
CMP: â‚¹426
Stop loss: â‚¹341
Duration: 6 Months
Trade Date: 06-12-2024
Trade Type: Momentum Pick

Note: Since we base our strategy on earnings and momentum, predicting the target price might lead to early exits. So, we will update the exit price as soon as the stock loses its momentum or becomes technically weak. Until then enjoy the ride. The ideal holding period for this call is six months.

Name of RA: T Manish

Disclaimer: https://sam-co.in/6j/ Samco Securities Ltd"
2024-12-06 03:06:40+00:00,-1001156495705,Traders Dashboard
2024-12-05 08:17:03+00:00,-1001156495705,"RECOMMENDATION ALERT ðŸ””

Stock Name: PNC Infratech Ltd
Symbol: PNCINFRA
Rating: Buy ðŸŸ¢
CMP: â‚¹309
Stop loss: â‚¹295
Target: 340
Duration: 5-10 Days
Trade Date: 05-12-2024
Trade Type: Short-Term Trade
Name of RA: Om Mehra

Disclaimer: https://sam-co.in/6j/ Samco Securities Ltd"
2024-12-05 06:47:53+00:00,-1001156495705,Book Profit and Exit @ 544
2024-12-05 06:18:46+00:00,-1001156495705,"RECOMMENDATION ALERT ðŸ””

Stock Name: UCO Bank Ltd
Symbol: UCOBANK
Rating: Buy ðŸŸ¢
CMP: â‚¹49.25
Stop loss: â‚¹39.40
Duration: 1 Year
Trade Date: 05-12-2024
Trade Type: Positional Pick

Note: Since our strategy is based on momentum, predicting the target price might lead to early exits. Therefore, we will update the exit price as soon as the momentum slows down. The maximum holding period for this call is one year.

Name of RA: Amar Nandu

Disclaimer: https://sam-co.in/6j/ Samco Securities Ltd"
2024-12-05 05:59:14+00:00,-1001156495705,"Book 4% Loss in Network 18 Media & Investments (TV18 Broadcast)

CMP: â‚¹ 46.03 (79.17*100/172)
Returns: -4.11%
Recommended Price: â‚¹ 48
Recommendation Date: 04-12-2023

We have completed the one-year holding period with this stock under the Positional Trading Pick. According to the strategy rules, we recommend investors to sell the stock and book 4% loss.

Disclaimer: https://sam-co.in/6j                 
Name of RA: Amar Nandu"
2024-12-05 05:38:15+00:00,-1001156495705,Target Achieved
2024-12-05 05:13:05+00:00,-1001156495705,"RECOMMENDATION ALERT ðŸ””

Stock Name: Swan Energy Ltd
Symbol: SWANENERGY
Rating: Buy ðŸŸ¢
CMP: â‚¹720
Stop loss: â‚¹576
Duration: 1 Year
Trade Date: 05-12-2024
Trade Type: Positional Pick

Note: Since we base our strategy on momentum, predicting the target price might lead to early exits. So, we will update the exit price as soon as the momentum slows down. The maximum holding period for this call is one year.

Name of RA: Amar Nandu

Disclaimer: https://sam-co.in/6j/ Samco Securities Ltd"
2024-12-05 03:18:04+00:00,-1001156495705,
2024-12-04 08:11:33+00:00,-1001156495705,Trail SL to 182 (CMP 187.5)
2024-12-04 04:03:08+00:00,-1001156495705,"RECOMMENDATION ALERT ðŸ””

Stock Name: Eicher Motors Ltd
Symbol: EICHERMOT24DEC4850CE
Rating: Buy ðŸŸ¢
CMP: â‚¹121
Stop loss: â‚¹105
Target: 156
Duration: 1-2 Days
Trade Date: 04-12-2024
Trade Type: Positional Stock Option
Name of RA: Om Mehra

Disclaimer: https://sam-co.in/6j/ Samco Securities Ltd"
2024-12-04 03:15:32+00:00,-1001156495705,
2024-12-03 08:46:51+00:00,-1001156495705,"RECOMMENDATION ALERT ðŸ””

Stock Name: Automotive Axles Ltd
Symbol: AUTOAXLES
Rating: Buy ðŸŸ¢
CMP: â‚¹1803
Stop loss: â‚¹1735
Target: 2060
Duration: 5-10 Days
Trade Date: 03-12-2024
Trade Type: Short-Term Trade
Name of RA: Om Mehra

Disclaimer: https://sam-co.in/6j/ Samco Securities Ltd"
2024-12-03 06:48:10+00:00,-1001156495705,"RECOMMENDATION ALERT ðŸ””

Stock Name: Harsha Engineers International Ltd
Symbol: HARSHA
Rating: Buy ðŸŸ¢
CMP: â‚¹512
Stop loss: â‚¹482
Target: 590
Duration: 5-10 Days
Trade Date: 03-12-2024
Trade Type: Short-Term Trade
Name of RA: Om Mehra

Disclaimer: https://sam-co.in/6j/ Samco Securities Ltd"
2024-12-03 04:33:39+00:00,-1001156495705,"Book 48% Profit in Aster DM Healthcare Ltd

CMP: â‚¹ 489 (ex-dividend)
Dividend: â‚¹118 (23-04-2024)
Returns: 48.05%
Recommended Price: â‚¹ 410
Recommendation Date: 01-12-2023

We have completed the one-year holding period with this stock under the Positional Trading Pick. According to the strategy rules, we recommend investors to sell the stock and book 48% profit.

Disclaimer: https://sam-co.in/6j            
Name of RA: Amar Nandu"
2024-12-03 03:12:37+00:00,-1001156495705,
2024-12-02 09:12:18+00:00,-1001156495705,"RECOMMENDATION ALERT ðŸ””

Stock Name: CESC Ltd
Symbol: CESC
Rating: Buy ðŸŸ¢
CMP: â‚¹177.2
Stop loss: â‚¹168
Target: 192
Duration: 5-10 Days
Trade Date: 02-12-2024
Trade Type: Short-Term Trade
Name of RA: Om Mehra

Disclaimer: https://sam-co.in/6j/ Samco Securities Ltd"
2024-12-02 06:49:35+00:00,-1001156495705,"RECOMMENDATION ALERT ðŸ””

Stock Name: Genus Power Infrastructures Ltd
Symbol: GENUSPOWER
Rating: Buy ðŸŸ¢
CMP: â‚¹456
Stop loss: â‚¹365
Duration: 6 Months
Trade Date: 02-12-2024
Trade Type: Momentum Pick
Name of RA: T Manish

Disclaimer: https://sam-co.in/6j/ Samco Securities Ltd"
2024-12-02 06:20:19+00:00,-1001156495705,"RECOMMENDATION ALERT ðŸ””

Stock Name: Vimta Labs Ltd
Symbol: VIMTALABS
Rating: Buy ðŸŸ¢
CMP: â‚¹903
Stop loss: â‚¹848
Target: 1048
Duration: 5-10 Days
Trade Date: 02-12-2024
Trade Type: Short-Term Trade
Name of RA: Om Mehra

Disclaimer: https://sam-co.in/6j/ Samco Securities Ltd"
2024-12-02 04:07:55+00:00,-1001156495705,"Book 36% Profit in Minda Corporation Ltd

CMP: â‚¹ 500
Returns: 36.24%
Recommended Price: â‚¹ 367
Recommendation Date: 30-11-2023

We have completed the one-year holding period with this stock under the Positional Trading Pick. According to the strategy rules, we recommend investors to sell the stock and book 36% profit.

Disclaimer: https://sam-co.in/6j
Name of RA: Amar Nandu"
2024-12-01 11:32:14+00:00,-1001156495705,
2024-11-30 08:03:22+00:00,-1001156495705,https://youtu.be/Sf0BUrx7J9M
2024-11-30 04:48:38+00:00,-1001156495705,
2024-11-29 08:07:03+00:00,-1001156495705,Exit @ 638.2
2024-11-29 06:57:04+00:00,-1001156495705,Book Profit and Exit @ 888
2024-11-29 06:19:49+00:00,-1001156495705,Exit @ 46
2024-11-29 04:20:03+00:00,-1001156495705,"RECOMMENDATION ALERT ðŸ””

Stock Name: Voltas Ltd
Symbol: VOLTAS24DEC1660CE
Rating: Buy ðŸŸ¢
CMP: â‚¹54
Stop loss: â‚¹44
Target: 69
Duration: 1-2 Days
Trade Date: 29-11-2024
Trade Type: Positional Stock Option
Name of RA: Om Mehra

Disclaimer: https://sam-co.in/6j/ Samco Securities Ltd"
2024-11-28 09:06:42+00:00,-1001156495705,Trail SL to 840 (CMP 865)
2024-11-28 08:27:36+00:00,-1001156495705,https://youtu.be/MsJf5cKn2nY
2024-11-28 05:55:23+00:00,-1001156495705,Book Profit and Exit @ 7320
2024-11-28 05:18:25+00:00,-1001156495705,Book Profit and Exit @ 1112
2024-11-28 05:05:17+00:00,-1001156495705,EXIT SL HIT IN NIFTY 24200 CE
2024-11-28 04:52:18+00:00,-1001156495705,"RECOMMENDATION ALERT ðŸ””

Stock Name: Aegis Logistics Ltd
Symbol: AEGISLOG
Rating: Buy ðŸŸ¢
CMP: â‚¹835
Stop loss: â‚¹800
Target: 945
Duration: 5-10 Days
Trade Date: 28-11-2024
Trade Type: Short-Term Trade
Name of RA: Om Mehra

Disclaimer: https://sam-co.in/6j/ Samco Securities Ltd"
2024-11-28 04:34:59+00:00,-1001156495705,"RECOMMENDATION ALERT ðŸ””

Stock Name: NIFTY
Symbol: NIFTY24D0524200CE
Rating: Buy ðŸŸ¢
CMP: â‚¹274
Stop loss: â‚¹240
Target: 330
Duration: INTRADAY
Trade Date: 28-11-2024
Trade Type: Intraday Call
Name of RA: Dhupesh Dhameja

Disclaimer: https://sam-co.in/6j/ Samco Securities Ltd"
2024-11-28 04:15:52+00:00,-1001156495705,"RECOMMENDATION ALERT ðŸ””

Stock Name: Elgi Equipments Ltd
Symbol: ELGIEQUIP
Rating: Buy ðŸŸ¢
CMP: â‚¹635
Stop loss: â‚¹608
Target: 740
Duration: 5-10 Days
Trade Date: 28-11-2024
Trade Type: Short-Term Trade
Name of RA: Om Mehra

Disclaimer: https://sam-co.in/6j/ Samco Securities Ltd"
2024-11-27 09:09:58+00:00,-1001156495705,"RECOMMENDATION ALERT ðŸ””

Stock Name: RPSG Ventures Ltd
Symbol: RPSGVENT
Rating: Buy ðŸŸ¢
CMP: â‚¹1090
Stop loss: â‚¹1048
Target: 1210
Duration: 5-10 Days
Trade Date: 27-11-2024
Trade Type: Short-Term Trade
Name of RA: Om Mehra

Disclaimer: https://sam-co.in/6j/ Samco Securities Ltd"
2024-11-27 08:36:37+00:00,-1001156495705,Book Profit and Exit @ 434
2024-11-27 07:44:00+00:00,-1001156495705,TARGET ACHIEVED IN NIFTY 24100CE
2024-11-27 06:47:56+00:00,-1001156495705,"RECOMMENDATION ALERT ðŸ””

Stock Name: NIFTY
Symbol: NIFTY24NOV24100CE
Rating: Buy ðŸŸ¢
CMP: â‚¹150
Stop loss: â‚¹125
Target: 200
Duration: INTRADAY
Trade Date: 27-11-2024
Trade Type: Intraday Call
Name of RA: Dhupesh Dhameja

Disclaimer: https://sam-co.in/6j/ Samco Securities Ltd"
2024-11-27 06:24:22+00:00,-1001156495705,EXIT FINNIFTY AT COST CMP 485
2024-11-27 06:24:18+00:00,-1001156495705,Exit @ 33.8
2024-11-27 05:46:47+00:00,-1001156495705,Book Profit and Exit @ 4420
2024-11-27 05:02:17+00:00,-1001156495705,"RECOMMENDATION ALERT ðŸ””

Stock Name: Aurobindo Pharma Ltd
Symbol: AUROPHARMA24DEC1240CE
Rating: Buy ðŸŸ¢
CMP: â‚¹38.5
Stop loss: â‚¹31
Target: 58
Duration: 1-2 Days
Trade Date: 27-11-2024
Trade Type: Positional Stock Option
Name of RA: Om Mehra

Disclaimer: https://sam-co.in/6j/ Samco Securities Ltd"
2024-11-27 04:49:53+00:00,-1001156495705,"RECOMMENDATION ALERT ðŸ””

Stock Name: FINNIFTY
Symbol: FINNIFTY24DEC24100CE
Rating: Buy ðŸŸ¢
CMP: â‚¹485
Stop loss: â‚¹450
Target: 550
Duration: INTRADAY
Trade Date: 27-11-2024
Trade Type: Intraday Call
Name of RA: Dhupesh Dhameja

Disclaimer: https://sam-co.in/6j/ Samco Securities Ltd"
2024-11-27 04:12:26+00:00,-1001156495705,"RECOMMENDATION ALERT ðŸ””

Stock Name: PCBL Ltd
Symbol: PCBL
Rating: Buy ðŸŸ¢
CMP: â‚¹419
Stop loss: â‚¹402
Target: 460
Duration: 5-10 Days
Trade Date: 27-11-2024
Trade Type: Short-Term Trade
Name of RA: Om Mehra

Disclaimer: https://sam-co.in/6j/ Samco Securities Ltd"
2024-11-27 04:04:59+00:00,-1001156495705,
2024-11-27 04:04:45+00:00,-1001156495705,
2024-11-26 09:58:20+00:00,-1001156495705,Book Profit and Exit @ 483
2024-11-26 09:50:33+00:00,-1001156495705,Book Profit and Exit @ 1220
2024-11-26 09:39:30+00:00,-1001156495705,Book Profit and Exit @ 24.4
2024-11-26 06:27:51+00:00,-1001156495705,"RECOMMENDATION ALERT ðŸ””

Stock Name: DLF Ltd
Symbol: DLF24DEC830PE
Rating: Buy ðŸŸ¢
CMP: â‚¹22.8
Stop loss: â‚¹18
Target: 36
Duration: 1-2 Days
Trade Date: 26-11-2024
Trade Type: Positional Stock Option
Name of RA: Om Mehra

Disclaimer: https://sam-co.in/6j/ Samco Securities Ltd"
2024-11-26 04:02:58+00:00,-1001156495705,"RECOMMENDATION ALERT ðŸ””

Stock Name: Mazagon Dock Shipbuilders Ltd
Symbol: MAZDOCK
Rating: Buy ðŸŸ¢
CMP: â‚¹4255
Stop loss: â‚¹4030
Target: 4880
Duration: 5-10 Days
Trade Date: 26-11-2024
Trade Type: Short-Term Trade
Name of RA: Om Mehra

Disclaimer: https://sam-co.in/6j/ Samco Securities Ltd"
2024-11-25 05:52:58+00:00,-1001156495705,BOOK PROFIT CMP 430
2024-11-25 05:49:37+00:00,-1001156495705,"RECOMMENDATION ALERT ðŸ””

Stock Name: Praj Industries Limited
Symbol: PRAJIND
Rating: Buy ðŸŸ¢
CMP: â‚¹812
Stop loss: â‚¹650
Duration: 1 Year
Trade Date: 25-11-2024
Trade Type: Positional Pick

Note: Since we base our strategy on momentum, predicting the target price might lead to early exits. So, we will update the exit price as soon as the momentum slows down. The maximum holding period for this call is one year.

Name of RA: Amar Nandu

Disclaimer: https://sam-co.in/6j/ Samco Securities Ltd"
2024-11-25 05:37:50+00:00,-1001156495705,"RECOMMENDATION ALERT ðŸ””

Stock Name: Saregama India Ltd
Symbol: SAREGAMA
Rating: Buy ðŸŸ¢
CMP: â‚¹468
Stop loss: â‚¹445
Target: 540
Duration: 5-10 Days
Trade Date: 25-11-2024
Trade Type: Short-Term Trade
Name of RA: Om Mehra

Disclaimer: https://sam-co.in/6j/ Samco Securities Ltd"
2024-11-25 05:06:37+00:00,-1001156495705,"RECOMMENDATION ALERT ðŸ””

Stock Name: BANKNIFTY
Symbol: BANKNIFTY24NOV52100CE
Rating: Buy ðŸŸ¢
CMP: â‚¹375
Stop loss: â‚¹310
Target: 500
Duration: INTRADAY
Trade Date: 25-11-2024
Trade Type: Intraday Call
Name of RA: Dhupesh Dhameja

Disclaimer: https://sam-co.in/6j/ Samco Securities Ltd"
2024-11-25 05:05:16+00:00,-1001156495705,"Book 62% Profit in CG Power & Industrial Solutions Ltd

CMP: â‚¹ 748
Returns: 61.56%
Recommended Price: â‚¹ 463
Recommendation Date: 23-11-2023

CG Power & Industrial Solutions is an international company that delivers comprehensive solutions for managing and utilizing electrical energy efficiently and sustainably. It caters to utilities, industries, and consumers, offering a range of products, services, and solutions across two primary business areas: Power Systems and Industrial Systems.

We have completed the one-year holding period with this stock under the Positional Trading Pick. According to the strategy rules, we recommend investors to sell the stock and book 62% profit.

Disclaimer: https://sam-co.in/6j     
Name of RA: Amar Nandu"
2024-11-25 05:03:59+00:00,-1001156495705,"RECOMMENDATION ALERT ðŸ””

Stock Name: XPRO India Ltd
Symbol: XPROINDIA
Rating: Buy ðŸŸ¢
CMP: â‚¹1171
Stop loss: â‚¹1118
Target: 1280
Duration: 5-10 Days
Trade Date: 25-11-2024
Trade Type: Short-Term Trade
Name of RA: Om Mehra

Disclaimer: https://sam-co.in/6j/ Samco Securities Ltd"
2024-11-25 04:42:08+00:00,-1001156495705,"RECOMMENDATION ALERT ðŸ””

Stock Name: Cera Sanitaryware Ltd
Symbol: CERA
Rating: Buy ðŸŸ¢
CMP: â‚¹7065
Stop loss: â‚¹6740
Target: 7820
Duration: 5-10 Days
Trade Date: 25-11-2024
Trade Type: Short-Term Trade
Name of RA: Om Mehra

Disclaimer: https://sam-co.in/6j/ Samco Securities Ltd"
2024-11-25 03:03:08+00:00,-1001156495705,
2024-11-24 11:32:55+00:00,-1001156495705,
2024-11-22 06:50:41+00:00,-1001156495705,Book profit CMP 106.50
2024-11-22 06:18:26+00:00,-1001156495705,"RECOMMENDATION ALERT ðŸ””

Stock Name: MIDCAPNIFTY
Symbol: MIDCPNIFTY24NOV12200CE
Rating: Buy ðŸŸ¢
CMP: â‚¹90
Stop loss: â‚¹74
Target: 130
Duration: INTRADAY
Trade Date: 22-11-2024
Trade Type: Intraday Call
Name of RA: Dhupesh Dhameja

Disclaimer: https://sam-co.in/6j/ Samco Securities Ltd"
2024-11-22 05:43:05+00:00,-1001156495705,Target Achieved
2024-11-22 04:40:40+00:00,-1001156495705,"RECOMMENDATION ALERT ðŸ””

Stock Name: Trent Ltd
Symbol: TRENT24NOV6500CE
Rating: Buy ðŸŸ¢
CMP: â‚¹100
Stop loss: â‚¹72
Target: 158
Duration: 1-2 Days
Trade Date: 22-11-2024
Trade Type: Positional Stock Option
Name of RA: Om Mehra

Disclaimer: https://sam-co.in/6j/ Samco Securities Ltd"
2024-11-22 04:16:41+00:00,-1001156495705,"Book 64% Profit in Tata Investment Corporation

CMP: â‚¹6560
Recommended Price: â‚¹ 4000
Recommendation Date: 20th November 2023
Duration:  1 year
Returns: 64%

We have completed the one-year holding period with this stock under the Positional Trading Pick. According to the strategy rules, we recommend investors to sell the stock and book 64% profit.

Name of RA: Amar Nandu 
Disclaimer: https://sam-co.in/6j"
2024-11-22 04:14:41+00:00,-1001156495705,"Exit Varroc Engineering

CMP: â‚¹510
Recommended Price: â‚¹ 553
Recommendation Date: 20th November 2023
Duration:  1 year
Returns: -7.78%

We have completed the one-year holding period with this stock under the Positional Trading Pick. According to the strategy rules, we recommend investors to sell the stock.

Name of RA: Amar Nandu 
Disclaimer: https://sam-co.in/6"
2024-11-22 02:51:27+00:00,-1001156495705,Traders Dashboard
2024-11-21 10:32:24+00:00,-1001156495705,We are live ðŸ”´ ðŸ‘‰ https://youtube.com/live/GhTaam8FHZM
2024-11-21 09:35:32+00:00,-1001156495705,Book Profit and Exit @ 26
2024-11-21 09:05:48+00:00,-1001156495705,Book Profit and Exit @ 3200
2024-11-21 08:08:06+00:00,-1001156495705,"RECOMMENDATION ALERT ðŸ””

Stock Name: United Spirits Ltd
Symbol: UNITDSPR24NOV1500PE
Rating: Buy ðŸŸ¢
CMP: â‚¹22.5
Stop loss: â‚¹14
Target: 37
Duration: 1-2 Days
Trade Date: 21-11-2024
Trade Type: Positional Stock Option
Name of RA: Om Mehra

Disclaimer: https://sam-co.in/6j/ Samco Securities Ltd"
2024-11-21 07:30:42+00:00,-1001156495705,"RECOMMENDATION ALERT ðŸ””

Stock Name: NIFTY
Symbol: NIFTY24NOV23350PE
Rating: Buy ðŸŸ¢
CMP: â‚¹178
Stop loss: â‚¹155
Target: 220
Duration: INTRADAY
Trade Date: 21-11-2024
Trade Type: Intraday Call
Name of RA: Dhupesh Dhameja

Disclaimer: https://sam-co.in/6j/ Samco Securities Ltd"
2024-11-21 05:53:12+00:00,-1001156495705,"Exit ACC Ltd

CMP: â‚¹1975
Recommended Price: â‚¹ 2500
Recommendation Date: 30th January 2024
Duration: 296 days
Returns: -21%
Allegations of bribery involving Gautam Adani, founder of the Adani Group, and an investigation by the U.S. Department of Justice concerning preferential treatment in renewable energy projects have raised concerns about corporate governance. Consequently, the share value has dipped by 20% from our entry point, ultimately triggering our pre-established stop loss.
Investors should follow the rules set by the system, cutting losers early and letting winners run.

Name of RA: Amar Nandu 

Disclaimer: https://sam-co.in/6j/ Samco Securities Ltd"
2024-11-21 03:52:46+00:00,-1001156495705,"Close Positional, SL Triggered"
2024-11-21 02:57:20+00:00,-1001156495705,Traders Dashboard
2024-11-19 09:49:07+00:00,-1001156495705,"RECOMMENDATION ALERT ðŸ””

Stock Name: Tamil Nadu Petro Products Ltd
Symbol: TNPETRO
Rating: Buy ðŸŸ¢
CMP: â‚¹78
Duration: 1 Year
Trade Date: 19-11-2024
Trade Type: Value Pick

Note: Since we base our strategy on fundamental parameters, predicting the target price might lead to early exits. So, we will update the exit price as soon as the stock becomes overvalued. Until then hold the stock. The ideal holding period for this recommendation is one year.

Name of RA: Raj Gaikar

Disclaimer: https://sam-co.in/6j/ Samco Securities Ltd"
2024-11-19 09:41:30+00:00,-1001156495705,"Close Position, SL Triggered"
2024-11-19 08:55:17+00:00,-1001156495705,"RECOMMENDATION ALERT ðŸ””

Stock Name: ICICI Bank Ltd
Symbol: ICICIBANK24NOV1250CE
Rating: Buy ðŸŸ¢
CMP: â‚¹17.7
Stop loss: â‚¹13.7
Target: 26
Duration: 1-2 Days
Trade Date: 19-11-2024
Trade Type: Positional Stock Option
Name of RA: Om Mehra

Disclaimer: https://sam-co.in/6j/ Samco Securities Ltd"
2024-11-19 08:33:05+00:00,-1001156495705,"RECOMMENDATION ALERT ðŸ””

Stock Name: Bharat Petroleum Corporation Ltd
Symbol: BPCL24NOV290CE
Rating: Buy ðŸŸ¢
CMP: â‚¹7.5
Stop loss: â‚¹5.2
Target: 10.8
Duration: 1-2 Days
Trade Date: 19-11-2024
Trade Type: Positional Stock Option
Name of RA: Om Mehra

Disclaimer: https://sam-co.in/6j/ Samco Securities Ltd"
2024-11-19 08:08:43+00:00,-1001156495705,Book profit and Exit @ 175
2024-11-19 06:56:13+00:00,-1001156495705,"RECOMMENDATION ALERT ðŸ””

Stock Name: Kirloskar Industries Ltd
Symbol: KIRLOSIND
Rating: Buy ðŸŸ¢
CMP: â‚¹4,511
Duration: 1 Year
Trade Date: 19-11-2024
Trade Type: Value Pick

Note: Since we base our strategy on fundamental parameters, predicting the target price might lead to early exits. So, we will update the exit price as soon as the stock becomes overvalued. Until then hold the stock. The ideal holding period for this recommendation is one year.

Name of RA: Raj Gaikar

Disclaimer: https://sam-co.in/6j/ Samco Securities Ltd"
2024-11-19 05:59:34+00:00,-1001156495705,"RECOMMENDATION ALERT ðŸ””

Stock Name: ABB India Ltd
Symbol: ABB24NOV6700CE
Rating: Buy ðŸŸ¢
CMP: â‚¹132
Stop loss: â‚¹112
Target: 182
Duration: 1-2 Days
Trade Date: 19-11-2024
Trade Type: Positional Stock Option
Name of RA: Om Mehra

Disclaimer: https://sam-co.in/6j/ Samco Securities Ltd"
2024-11-19 04:58:28+00:00,-1001156495705,Target Achieved
2024-11-19 04:40:10+00:00,-1001156495705,"To all the men shaping their futures with focus and drive, may your journey be as steady as a chart on the rise. 
Happy International Menâ€™s Day!"
2024-11-19 04:23:53+00:00,-1001156495705,"Exit Sonata Software

CMP: â‚¹561.35
Recommended Price: â‚¹ 699
Recommendation Date: 15th July 2024
Duration: 127 days
Returns: -19.69%
The impact of weakness in the broader market indices was also seen in Sonata Software. Consequently, the share value has dipped by 20% from our entry point, ultimately triggering our pre-established stop loss.
Investors should follow the rules set by the system, cutting losers early and letting winners run.

Disclaimer: https://sam-co.in/6j         

Name of RA: Amar Nandu"
2024-11-19 04:08:56+00:00,-1001156495705,"RECOMMENDATION ALERT ðŸ””

Stock Name: BANKNIFTY
Symbol: BANKNIFTY24NOV50500CE
Rating: Buy ðŸŸ¢
CMP: â‚¹565
Stop loss: â‚¹500
Target: 650
Duration: INTRADAY
Trade Date: 19-11-2024
Trade Type: Intraday Call
Name of RA: Dhupesh Dhameja

Disclaimer: https://sam-co.in/6j/ Samco Securities Ltd"
2024-11-19 03:58:21+00:00,-1001156495705,"RECOMMENDATION ALERT ðŸ””

Stock Name: Titan Company Ltd
Symbol: TITAN24NOV3200CE
Rating: Buy ðŸŸ¢
CMP: â‚¹42.2
Stop loss: â‚¹29
Target: 68
Duration: 1-2 Days
Trade Date: 19-11-2024
Trade Type: Positional Stock Option
Name of RA: Om Mehra

Disclaimer: https://sam-co.in/6j/ Samco Securities Ltd"
2024-11-19 02:53:45+00:00,-1001156495705,Traders Dashboard
2024-11-18 09:48:22+00:00,-1001156495705,Book Profit and Exit @ 43.3
2024-11-18 08:59:16+00:00,-1001156495705,"RECOMMENDATION ALERT ðŸ””

Stock Name: Hindustan Unilever Ltd
Symbol: HINDUNILVR24NOV2400CE
Rating: Buy ðŸŸ¢
CMP: â‚¹37
Stop loss: â‚¹27
Target: 54
Duration: 1-2 Days
Trade Date: 18-11-2024
Trade Type: Positional Stock Option
Name of RA: Om Mehra

Disclaimer: https://sam-co.in/6j/ Samco Securities Ltd"
2024-11-18 08:40:06+00:00,-1001156495705,"RECOMMENDATION ALERT ðŸ””

Stock Name: Mastek Ltd
Symbol: MASTEK
Rating: Buy ðŸŸ¢
CMP: â‚¹3130
Stop loss: â‚¹2975
Target: 3580
Duration: 5-10 Days
Trade Date: 18-11-2024
Trade Type: Short-Term Trade
Name of RA: Om Mehra

Disclaimer: https://sam-co.in/6j/ Samco Securities Ltd"
2024-11-18 07:08:37+00:00,-1001156495705,Target Achieved
2024-11-18 06:39:02+00:00,-1001156495705,"RECOMMENDATION ALERT ðŸ””

Stock Name: JSW Steel Ltd
Symbol: JSWSTEEL24NOV940CE
Rating: Buy ðŸŸ¢
CMP: â‚¹17.7
Stop loss: â‚¹12.2
Target: 25
Duration: 1-2 Days
Trade Date: 18-11-2024
Trade Type: Positional Stock Option
Name of RA: Om Mehra

Disclaimer: https://sam-co.in/6j/ Samco Securities Ltd"
2024-11-18 05:54:00+00:00,-1001156495705,"RECOMMENDATION ALERT ðŸ””

Stock Name: Kernex Microsystems (India) Ltd
Symbol: KERNEX
Rating: Buy ðŸŸ¢
CMP: â‚¹862
Stop loss: â‚¹693
Duration: 6 Months
Trade Date: 18-11-2024
Trade Type: Momentum Pick

Note: Since we base our strategy on earnings and momentum, predicting the target price might lead to early exits. So, we will update the exit price as soon as the stock loses its momentum or becomes technically weak. Until then enjoy the ride. The ideal holding period for this call is six months.

Name of RA: T Manish

Disclaimer: https://sam-co.in/6j/ Samco Securities Ltd"
2024-11-18 05:21:59+00:00,-1001156495705,"RECOMMENDATION ALERT ðŸ””

Stock Name: FINNIFTY
Symbol: FINNIFTY24N1923300PE
Rating: Buy ðŸŸ¢
CMP: â‚¹132
Stop loss: â‚¹105
Duration: INTRADAY
Trade Date: 18-11-2024
Trade Type: Intraday Call
Name of RA: Dhupesh Dhameja

Disclaimer: https://sam-co.in/6j/ Samco Securities Ltd"
2024-11-18 04:53:56+00:00,-1001156495705,"We recommended Balkrishna Industries ltd as it posted its highest-ever sales and PAT in Q4FY24 and recorded a decent YoY growth.
The stock was also trading close to its previous highs.
Despite the company recording such stellar results it could not continue its results spree in the consecutive quarters, and the duration to hold the stock is also is also over. So we are recommending to exit & book loss in the stock at Rs. 2760 levels, yielding -8.4% in 6 months.
Feel free to share your thoughts on the suggested recommendations. You can write to us on support@samco.in"
2024-11-18 04:40:05+00:00,-1001156495705,"Exit RattanIndia Enterprises

CMP: â‚¹61.15
Recommended Price: â‚¹ 78
Recommendation Date: 23rd November 2023
Duration: 360 days
Returns: -21.6%
The impact of weakness in the broader market indices was also seen in RattanIndia Enterprise. Moreover the quarterly result of Quarter 2 was not bright with the company recording a loss of Rs 242 crores with sales growth of 12% on a YOY basis. Consequently, the share value has dipped by 20% from our entry point, ultimately triggering our pre-established stop loss. Investors should follow the rules set by the system, cutting losers early and letting winners run.

Disclaimer: https://sam-co.in/6j         

Name of RA: Amar Nandu"
2024-11-18 02:52:34+00:00,-1001156495705,Traders Dashboard
2024-11-17 11:32:26+00:00,-1001156495705,
2024-11-16 06:07:28+00:00,-1001156495705,https://youtu.be/WcZPAA5xWiQ?si=Xn2di1taqRx6NPBb
2024-11-15 11:53:33+00:00,-1001156495705,"Join us tomorrow at 11 a.m., where Apurva Sheth continues his conversation with Vishal Malkhan to address ""How to Use Momentum & Volatility to Pick the Best Stock Trades""

Don't forget to see this episode exclusively on The Right Choices with the Oracles of Dalal Street"
2024-11-15 05:29:04+00:00,-1001156495705,"Inspired by Guru Nanakâ€™s wisdom, patience and discipline are essential not only in life but also in the world of trading. Samco wishes one and all, a very happy Guru Nanak Jayanti."
2024-11-14 11:17:27+00:00,-1001156495705,
2024-11-14 05:07:06+00:00,-1001156495705,BOOK PROFIT IN MIDCAP 12150CE CMP 97.85
2024-11-14 04:52:11+00:00,-1001156495705,"From Saturday morning cartoons to Monday market openings, some things never change. This Childrenâ€™s Day, letâ€™s remember how far weâ€™ve come while stayed right there."
2024-11-14 04:45:42+00:00,-1001156495705,"RECOMMENDATION ALERT ðŸ””

Stock Name: MIDCAPNIFTY
Symbol: MIDCPNIFTY24N1812150CE
Rating: Buy ðŸŸ¢
CMP: â‚¹78
Stop loss: â‚¹55
Target: 120
Duration: INTRADAY
Trade Date: 14-11-2024
Trade Type: Intraday Call
Name of RA: Dhupesh Dhameja

Disclaimer: https://sam-co.in/6j/ Samco Securities Ltd"
2024-11-14 04:06:53+00:00,-1001156495705,"Despite the company recording such stellar results it could not continue its results spree in consecutive quarters, and also the time duration of the stock is over. So we are recommending to exit & book loss in the stock at Rs. 1,615 levels, yielding -6.5% in 6 months.
Feel free to share your thoughts on the suggested recommendations. You can write to us on support@samco.in"
2024-11-14 02:51:32+00:00,-1001156495705,Traders Dashboard
2024-11-13 10:29:17+00:00,-1001156495705,We are live ðŸ”´ ðŸ‘‰ https://youtube.com/live/UmBEtexP7O8
2024-11-13 09:38:53+00:00,-1001156495705,EXIT IN TASTYBITE CMP 11645
2024-11-13 08:15:53+00:00,-1001156495705,EXIT SL HIT IN NAMINDIA CMP 685
2024-11-13 07:59:17+00:00,-1001156495705,EXIT SL HIT IN GUFICBIO CMP 440
2024-11-13 06:23:59+00:00,-1001156495705,"Delivery Trading Pick: Exit from Saregama India Limited!

Saregama reached a high of 688 following our recommendation. However, the stockâ€™s momentum has declined due to weak market sentiment and lower-than-expected Q2FY25 results. Based on our backtesting, the ideal holding period in our strategy is three months. We therefore recommend exiting Saregama India Limited."
2024-11-13 06:00:34+00:00,-1001156495705,EXIT CMP 150
2024-11-13 05:26:34+00:00,-1001156495705,"RECOMMENDATION ALERT ðŸ””

Stock Name: NIFTY
Symbol: NIFTY24N1423650CE
Rating: Buy ðŸŸ¢
CMP: â‚¹155
Stop loss: â‚¹125
Target: 200
Duration: INTRADAY
Trade Date: 13-11-2024
Trade Type: Intraday Call
Name of RA: Dhupesh Dhameja

Disclaimer: https://sam-co.in/6j/ Samco Securities Ltd"
2024-11-13 04:27:01+00:00,-1001156495705,"Exit Castrol India

CMP: â‚¹199
Recommended Price: â‚¹ 255
Recommendation Date: 04-07-2024
Duration: 131 days
Returns: -21.96%

The impact of weakness in the broader market indices was also seen in Castrol India. As a consequence, the share value has dipped by 20% from our entry point, ultimately triggering our pre-established stop loss. Investors should follow the rules set by the system, cutting losers early and letting winners run. 

Name of RA: Amar Nandu

Disclaimer: https://sam-co.in/6j/ Samco Securities Ltd"
2024-11-13 02:49:04+00:00,-1001156495705,Traders Dashboard
2024-11-12 07:12:33+00:00,-1001156495705,BOOK PROFIT AND EXIT CMP 193
2024-11-12 05:10:12+00:00,-1001156495705,"RECOMMENDATION ALERT ðŸ””

Stock Name: NAMINDIA
Symbol: NAM-INDIA
Rating: Buy ðŸŸ¢
CMP: â‚¹705
Stop loss: â‚¹685
Duration: 5-10 Days
Trade Date: 12-11-2024
Trade Type: Short-Term Trade
Name of RA: Dhupesh Dhameja

Disclaimer: https://sam-co.in/6j/ Samco Securities Ltd"
2024-11-12 05:08:09+00:00,-1001156495705,"RECOMMENDATION ALERT ðŸ””

Stock Name: MIDCAPNIFTY
Symbol: MIDCPNIFTY24N1812600PE
Rating: Buy ðŸŸ¢
CMP: â‚¹160
Stop loss: â‚¹140
Target: 200
Duration: INTRADAY
Trade Date: 12-11-2024
Trade Type: Intraday Call
Name of RA: Dhupesh Dhameja

Disclaimer: https://sam-co.in/6j/ Samco Securities Ltd"
2024-11-12 02:51:39+00:00,-1001156495705,Traders Dashboard
2024-11-11 06:04:54+00:00,-1001156495705,"RECOMMENDATION ALERT ðŸ””

Stock Name: NIIT Ltd
Symbol: NIITLTD
Rating: Buy ðŸŸ¢
CMP: â‚¹196
Stop loss: â‚¹180
Target: 240
Duration: 5-10 Days
Trade Date: 11-11-2024
Trade Type: Short-Term Trade
Name of RA: Dhupesh Dhameja

Disclaimer: https://sam-co.in/6j/ Samco Securities Ltd"
2024-11-11 05:14:57+00:00,-1001156495705,EXIT SL HIT IN FSL CMP 365
2024-11-11 04:09:25+00:00,-1001156495705,
2024-11-11 04:09:07+00:00,-1001156495705,
2024-11-11 03:49:34+00:00,-1001156495705,
2024-11-11 02:54:49+00:00,-1001156495705,Traders Dashboard
2024-11-10 12:24:43+00:00,-1001156495705,
2024-11-09 05:54:54+00:00,-1001156495705,https://youtu.be/2JQvC8FMzUs?si=L-l5eMGB8aVKMtc2
2024-11-08 12:00:49+00:00,-1001156495705,"Join us tomorrow at 11 a.m., where 
Apurva Sheth is in conversation with Vishal Malkan to address ""How to Pick a Stock for Long-Term Success""

Don't forget to see this episode exclusively on The Right Choices with the Oracles of Dalal Street"
2024-11-08 09:22:26+00:00,-1001156495705,Book Profit and Exit @ 305
2024-11-08 06:32:22+00:00,-1001156495705,BOOK PROFIT CMP 206
2024-11-08 06:06:47+00:00,-1001156495705,"RECOMMENDATION ALERT ðŸ””

Stock Name: NIFTY
Symbol: NIFTY24N1424200PE
Rating: Buy ðŸŸ¢
CMP: â‚¹174
Stop loss: â‚¹145
Target: 220
Duration: INTRADAY
Trade Date: 08-11-2024
Trade Type: Intraday Call
Name of RA: Dhupesh Dhameja

Disclaimer: https://sam-co.in/6j/ Samco Securities Ltd"
2024-11-08 05:35:38+00:00,-1001156495705,"We recommend booking profits in JSW Holdings Ltd. The stock has been rallying for the past few weeks and moved up by 105% from our recommended price in less than 5 months. It is up more than 50% in just 3 days without much material change in fundamentals. 
We recommended buying JSW Holdings at a price-to-book (PB) multiple of 0.3 in June 2024. SEBI had announced a special call auction session for holding companies. The final list which the exchange published didnâ€™t include JSW Holdings for the special call auction session but the stock has still managed to move up. 
The stock is currently trading at PB multiple of almost 0.5. The multiple is not stretched and the stock still has further potential for upside till 20,000 levels. However, we believe that 50% upside in 3 days warrants for a profit booking. 
Feel free to share your thoughts on the suggested recommendations. You can write to us on  support@samco.in"
2024-11-08 05:18:11+00:00,-1001156495705,"RECOMMENDATION ALERT ðŸ””

Stock Name: Apollo Hospitals Enterprise Ltd
Symbol: APOLLOHOSP
Rating: Buy ðŸŸ¢
CMP: â‚¹7440
Stop loss: â‚¹5953
Duration: 6 Months
Trade Date: 08-11-2024
Trade Type: Momentum Pick

Note: Since we base our strategy on earnings and momentum, predicting the target price might lead to early exits. So, we will update the exit price as soon as the stock loses its momentum or becomes technically weak. Until then enjoy the ride. The ideal holding period for this call is six months.

Name of RA: T Manish

Disclaimer: https://sam-co.in/6j/ Samco Securities Ltd"
2024-11-08 05:12:03+00:00,-1001156495705,"RECOMMENDATION ALERT ðŸ””

Stock Name: Larsen & Toubro Ltd
Symbol: LT24NOV3650PE
Rating: Buy ðŸŸ¢
CMP: â‚¹54
Stop loss: â‚¹41
Target: 80
Duration: 1-2 Days
Trade Date: 08-11-2024
Trade Type: Positional Stock Option
Name of RA: Om Mehra

Disclaimer: https://sam-co.in/6j/ Samco Securities Ltd"
2024-11-08 02:48:41+00:00,-1001156495705,Traders Dashboard
2024-11-07 10:32:37+00:00,-1001156495705,https://youtu.be/qs7VIlNJdKI
2024-11-07 07:00:04+00:00,-1001156495705,EXIT SL HIT
2024-11-07 06:35:10+00:00,-1001156495705,"RECOMMENDATION ALERT ðŸ””

Stock Name: BANKNIFTY
Symbol: BANKNIFTY13NOV2451800PE
Rating: Buy ðŸŸ¢
CMP: â‚¹390
Stop loss: â‚¹335
Target: 500
Duration: INTRADAY
Trade Date: 07-11-2024
Trade Type: Intraday Call
Name of RA: Dhupesh Dhameja

Disclaimer: https://sam-co.in/6j/ Samco Securities Ltd"
2024-11-07 06:05:58+00:00,-1001156495705,https://youtu.be/n-G3Ge5QAaw
2024-11-07 04:57:52+00:00,-1001156495705,"Exit JK Lakshmi Cement Ltd

CMP: â‚¹ 775  
Returns: 0%
Recommended Price: â‚¹ 775
Recommendation Date: 06-11-2023


JK Lakshmi Cement Ltd, part of the JK Group, produces and supplies cement along with related products like Ready-Mix Concrete (RMC) and Autoclaved Aerated Concrete (AAC) blocks across various states in India.

The company announced a Rs. 19 crore consolidated loss in Q2 FY25 yesterday after the market closed, which caused the share price to fall over 3% today.

We have completed the one-year holding period with this stock under the Positional Trading Pick. According to the strategy rules, we recommend investors to sell the stock and book 0% profit.

Disclaimer: https://sam-co.in/6j  
Name of RA: Amar Nandu"
2024-11-07 02:50:42+00:00,-1001156495705,Traders Dashboard
2024-11-06 10:27:06+00:00,-1001156495705,We are live ðŸ”´ ðŸ‘‰ https://youtube.com/live/tiO0Aq5yuXg
2024-11-06 09:43:42+00:00,-1001156495705,"RECOMMENDATION ALERT ðŸ””

Stock Name: Tejas Networks Ltd
Symbol: TEJASNET
Rating: Buy ðŸŸ¢
CMP: â‚¹1400
Stop loss: â‚¹1125
Duration: 6 Months
Trade Date: 06-11-2024
Trade Type: Momentum Pick

Note: Since we base our strategy on earnings and momentum, predicting the target price might lead to early exits. So, we will update the exit price as soon as the stock loses its momentum or becomes technically weak. Until then enjoy the ride. The ideal holding period for this call is six months.

Name of RA: T Manish

Disclaimer: https://sam-co.in/6j/ Samco Securities Ltd"
2024-11-06 09:42:34+00:00,-1001156495705,"RECOMMENDATION ALERT ðŸ””

Stock Name: TVS Motor Company Ltd
Symbol: TVSMOTOR
Rating: Buy ðŸŸ¢
CMP: â‚¹2485
Stop loss: â‚¹1990
Duration: 6 Months
Trade Date: 06-11-2024
Trade Type: Momentum Pick

Note: Since we base our strategy on earnings and momentum, predicting the target price might lead to early exits. So, we will update the exit price as soon as the stock loses its momentum or becomes technically weak. Until then enjoy the ride. The ideal holding period for this call is six months.

Name of RA: T Manish

Disclaimer: https://sam-co.in/6j/ Samco Securities Ltd"
2024-11-06 09:35:25+00:00,-1001156495705,https://youtu.be/cQHqX7oC1Rk
2024-11-06 08:32:29+00:00,-1001156495705,"RECOMMENDATION ALERT ðŸ””

Stock Name: Firstsource Solutions Ltd
Symbol: FSL
Rating: Buy ðŸŸ¢
CMP: â‚¹383
Stop loss: â‚¹365
Target: 440
Duration: 5-10 Days
Trade Date: 06-11-2024
Trade Type: Short-Term Trade
Name of RA: Om Mehra

Disclaimer: https://sam-co.in/6j/ Samco Securities Ltd"
2024-11-06 07:15:59+00:00,-1001156495705,https://youtu.be/4LCE7n7gBeg
2024-11-06 06:27:46+00:00,-1001156495705,BOOK PROFIT IN FINNIFTY 24150 CE CMP 248
2024-11-06 06:06:08+00:00,-1001156495705,"RECOMMENDATION ALERT ðŸ””

Stock Name: FINNIFTY
Symbol: FINNIFTY24N1224150CE
Rating: Buy ðŸŸ¢
CMP: â‚¹209
Stop loss: â‚¹179
Target: 270
Duration: INTRADAY
Trade Date: 06-11-2024
Trade Type: Intraday Call
Name of RA: Dhupesh Dhameja

Disclaimer: https://sam-co.in/6j/ Samco Securities Ltd"
2024-11-06 04:21:45+00:00,-1001156495705,"RECOMMENDATION ALERT ðŸ””

Stock Name: Tasty Bite Eatables Ltd
Symbol: TASTYBITE
Rating: Buy ðŸŸ¢
CMP: â‚¹12190
Stop loss: â‚¹11480
Target: 14300
Duration: 5-10 Days
Trade Date: 06-11-2024
Trade Type: Short-Term Trade
Name of RA: Om Mehra

Disclaimer: https://sam-co.in/6j/ Samco Securities Ltd"
2024-11-06 03:59:04+00:00,-1001156495705,Exit @ 62.4
2024-11-06 02:47:37+00:00,-1001156495705,Traders Dashboard
2024-11-05 12:22:08+00:00,-1001156495705,"Nifty closed at 24,205.35, down nearly 6.22% in October, one of the largest monthly losses since March 2020. The global market remained neutral, while continuous selling by foreign portfolio investors (FPIs) has adversely impacted the domestic market.

In our Positional Stock Option Strategy, we shared 16 recommendations, resulting in 7 gains and 9 losses. The strike rate stands at 43.7%, with an average gain of -0.9%, totalling an overall loss of 2,485. 

Option premiums experienced significant fluctuations, with prices standing and reversing within minutes, making it challenging to capitalize on profits. Overall, the trend largely followed our analysis, but instant swings in premiums and theta decay, as implied volatility shrank, contributed to the losses.
Despite the challenging last month our performance in the last three months was solid with total gains of Rs 22,028 if you traded one lot for each recommendation we made.

We opted mostly not to carry trades due to heightened volatility and making quick adjustments and early profit booking crucial.
The market has shifted from bullish to bearish, complicating stock and strike selection due to sharply rising delta values. We must be cautious in the coming months, as high swings in stocks and constantly changing trends will significantly impact premiums.

A balanced approach involving riding bullish trends with calls and bearish trends with puts is the key to success in stock options trading. We maintain our stance of booking early profits to capitalize on market movements efficiently. This strategy enables traders to remain active in response to the prevailing market trends.

We thank you for being a part of our Positional Stock Option strategy."
2024-11-05 12:22:07+00:00,-1001156495705,
2024-11-05 12:21:11+00:00,-1001156495705,"Nifty closed at 24,205.35, down nearly 6.22% in October, one of the largest monthly losses since March 2020. The global market remained neutral, while continuous selling by foreign portfolio investors (FPIs) has adversely impacted the domestic market.
We booked profits in 7 and closed 11 in negative. Our strike rate remains at 38.9% monthly average monthly gain stands at a modest -0.40%.
The primary driver of our losses stemmed from significant price swings during morning trades, which shifted momentum from profit to loss. To address this, we will refine our stock selection process and be more proactive in exiting positions, as many stocks initially surged before either consolidating or trending downward. We also encountered several false breakouts that hindered us from capitalizing on emerging trends.
October presented challenges that resulted in a drawdown, but we had notable successes with Poly Medicure Ltd and RPG Life Sciences Ltd, which delivered impressive returns of 11.68% and 9.88%, respectively. Conversely, Tata Chemicals Ltd emerged as the month's underperformer.
The majority of stocks remained below their 20-day and 50-day moving averages, complicating trend-following strategies. Moving forward, we will prioritize identifying critical support levels and utilizing indicators such as Bollinger Bands, along with a heightened focus on volume and bullish divergence in our stock selection process to spot reversal trades.
The India VIX is above the 15 level, we anticipate heightened volatility in the coming month. We will remain vigilant and emphasize early profit booking to mitigate risks. Another area we will focus on is recommend only extremely high conviction trading ideas. As market dynamics evolve, we are committed to adjusting our approach to navigate the shifting landscape effectively.

Happy trading!"
2024-11-05 12:21:06+00:00,-1001156495705,
2024-11-05 12:15:27+00:00,-1001156495705,"Delivery Trading Pick: October 2024: Small & Midcaps Take the Spotlight 

In October 2024, the Indian stock market faced a turbulent month, with small and midcap stocks at the center of activity. The RBIâ€™s decision to maintain the repo rate at 6.5% helped stabilize market sentiment in the monthâ€™s start. Smallcaps and midcaps faced heavy selling pressure as foreign investors offloaded over Rs. 1,00,000 crore, leading to heightened volatility and significant losses. Interest in gold surged amid global uncertainties, signaling a shift toward safe-haven assets. By month-end, the small and midcaps rebounded slightly, yet elevated volatility indicated a cautious market outlook moving forward.

Now let us examine the performance of our strategy for the monthâ€¦
In October 2024, we issued one recommendation in our Delivery Trading Pick. Despite the marketâ€™s volatility, five of our recommended stocks ended the month on a positive note. However, we exited our positions in Jain Irrigation Systems and Ashoka Buildcon as they hit their stop-loss levels during the month.

We have recommended 88 stocks employing this strategy to date, with 8 of these trades still active. Although our success rate of 51% might look lower, our average gain is still positive indicating that the profitable recommendations make up for the losing trades. We have even made changes to our model, which will likely improve our success rate going forward. 

Our overall average gain was significantly impacted on account of stocks hitting stop-loss levels due to high volatility witnessed by small and midcaps. To navigate high-volatility environments, we have adjusted our strategy to hold stocks for three months with a 20% stop-loss. This approach is designed to limit risks while optimizing returns. 

The average gain for Delivery Trading Picks is approximately 4.50%, achieved within an average holding period of only 47 days. When annualized, this equates to an average gain of approximately 35%. 

We remain committed to providing precise entry prices and stop-loss levels. 

Our primary objective is to maximize the potential for enhancing your investments and consistently aim to outperform the benchmark index, regardless of market conditions. We invite you to join us in this journey to seize short-term opportunities and optimize your investments.

Hereâ€™s the performance of all recommendations closed till September 2024.
Thank You!"
2024-11-05 12:15:27+00:00,-1001156495705,
2024-11-05 12:15:27+00:00,-1001156495705,
2024-11-05 12:15:27+00:00,-1001156495705,
2024-11-05 12:15:27+00:00,-1001156495705,
2024-11-05 12:15:27+00:00,-1001156495705,
2024-11-05 11:37:05+00:00,-1001156495705,"Value Picks â€“ October 2024 Performance â€“ Resilient Gains Amid Niftyâ€™s Slide! 

In October, the Indian equity market faced significant bearish pressure, with the Nifty 50 index declining by 1,605 points, marking a drawdown of -6.22%. The India VIX surged past the 15 level on a monthly closing basis for the first time in four months, signaling heightened volatility and increasing risk aversion among investors. These factors had a modest negative impact on our holdings, leading to a 3% decline in the strategyâ€™s average returns compared to the previous month.
Under our value pick strategy, we aim to identify stocks with strong fundamentals offering significant upside potential which are trading below their book value. Purchasing stocks below their intrinsic value gives us a substantial margin of safety, allowing us to maximize returns with low risk.

Now let us examine our Value Pick strategy performance in October 2024.
Under our Value Pick strategy, we recommended to buy Vindhya Telelinks, which engaged in the manufacturing and distribution of diverse cable products, including telecom cables, FRP rods, and glass rovings. It holds stakes in notable companies like Birla Cable Ltd, Birla Corporation Ltd, and Universal Cable Ltd., contributing to its robust investment portfolio valued at approximately â‚¹1,474 crore with a market cap of â‚¹2,545 crore. Trading at an attractive price-to-book multiple of 0.63 and a price-to-earnings multiple of 10 it provides a margin of safety to enter at such low valuation.

SEBI conducted a special auction session this month for holding companies, which led to heightened volatility in their share prices. We already recommended four holding companies, of which NSIL and PILANIINVS saw a significant rally this month, rising 26% and 20%, respectively. We believe that following SEBI's special auction session, holding companies are likely to witness further value unlocking, potentially leading to rising share prices in the near future.

Our current strategy recommendations comprise 14 active positions, with 9 trading above the recommended entry levels, reflecting a strategy strike rate of 67%. 
The strategyâ€™s average gain stands at an impressive 16.26%. Out of the active positions Century Enka remained the top performer with a gain of 42.45%, followed by NSIL and JSWHL, delivering returns of 36.18% and 35.39%, respectively. 

We appreciate your continued engagement with the Value Pick plan and look forward to sharing more such opportunities with you in the months ahead. Stay tunedâ€¦
Thank you!"
2024-11-05 11:37:04+00:00,-1001156495705,
2024-11-05 11:37:04+00:00,-1001156495705,
2024-11-05 10:53:41+00:00,-1001156495705,"Index Option Buying Strategy Secures Impressive Monthly Gains Despite Market Pressure ðŸ˜Š

In October, the Nifty index posted a subdued 6.22% drop amidst heightened volatility, reaching a monthly low of 24,073 and a high of 25,907. Both Nifty and Bank Nifty experienced sharp selloffs from the monthâ€™s outset, failing to show any recovery as sellers-maintained control throughout. The downturn stemmed largely from disappointing Q2 earnings and a sustained net selling trend by Foreign Portfolio Investors (FPIs). Major stocks also saw intensified profit-booking, with both indices failing to hold critical support levels.

Index Buying Strategy Performance: In October, our Index Buying Strategy delivered notable results, achieving an overall strike rate of 65% across 20 recommended trades. The breakdown of results is as follows:
Bank Nifty: 1 trade (1 winner)
Fin Nifty: 2 trades (1 winner, 1 loser)
Nifty: 14 trades (9 winners, 5 losers)
Midcap Nifty: 3 trades (2 winners, 1 loser)

The strategy achieved an average gain of 3.47% per trade, resulting in a total profit of â‚¹10,180 per lot traded. Strong risk management was key to these results, with winning trades yielding an average return of â‚¹1,135, while losses averaged â‚¹653.

Outlook for November: As we move into November, weâ€™ll adopt a more cautious approach in light of increased market volatility and muted option premium momentum. The market has been opening with significant gaps, impacting intraday momentum and increasing the frequency of stop-loss hits. To navigate this, weâ€™ll adjust our strategy to align with the heightened volatility, focusing on capturing precise intraday moves.

While challenges remain, we are optimistic about capitalizing on momentum shifts and maintaining robust performance. Our strategy will continue to evolve to meet market demands and deliver consistent results.

Thank you for your trust in our approach. We look forward to another successful month ahead."
2024-11-05 10:53:38+00:00,-1001156495705,
2024-11-05 10:53:38+00:00,-1001156495705,
2024-11-05 10:35:39+00:00,-1001156495705,"October Market Recap: Nifty Decline, FII Withdrawals, and Performance Review  

October proved challenging for the Indian equity market. The Nifty index declined by around 2000 points from its peak within almost a month. This broad market downturn was driven by FII sell-offs, with over â‚¹1 lakh crore withdrawn on a net basis in October. The market was also influenced by Q2 earnings results and speculation around demand uptick in the festive season in select industries.

The Nifty 500 strategy universe also saw a decline of over 6% during the month, breaking its eleven-month positive return trajectory. Our recommendations were similarly impacted by prevailing market uncertainty.

We exited positions in Vardhman Textiles Ltd., Rites Ltd., Alok Industries Ltd., and PNC Infratech Ltd. due to stop-loss triggers. Additionally, after completing the one-year holding period, we booked gains in Metro Brands Ltd. (0.90%), Godrej Industries Ltd. (60.00%), and Bombay Burmah Trading Corporation Ltd. (85.21%).

We made three new recommendations in October 2024, and their performance is detailed in the table above: 

Among our live positions in the Positional Trading Pick, Motilal Oswal Financial Services Ltd. (28.20%) and Amber Enterprises India Ltd. (27.24%) were the top gainers, while PCBL (-26.42%) provided the lowest return for the month.

Although the strategyâ€™s average gain declined from 34.06% last month to 30.52% since inception, it remains resilient with a strike rate of 64.37% (56/87 stocks).
(Note: Returns are based on the last traded prices as of 1st November 2024.)

Several significant events are upcoming this month, including the US elections, a Fed meeting with a potential rate cut, and the release of Q2 earnings for many companies. It remains to be seen whether FII flows will return to Indian equities, setting the Nifty on a renewed bullish trajectory or prompting further corrections.
Hold firmly to investments you have conviction in during this market turbulence, as the current volatility will eventually subside, likely boosting the value of your investments.

Thank you!"
2024-11-05 10:35:24+00:00,-1001156495705,
2024-11-05 10:35:24+00:00,-1001156495705,
2024-11-05 10:35:24+00:00,-1001156495705,
2024-11-05 10:35:24+00:00,-1001156495705,
2024-11-05 10:35:24+00:00,-1001156495705,
2024-11-05 10:09:02+00:00,-1001156495705,
2024-11-05 10:09:02+00:00,-1001156495705,
2024-11-05 10:09:02+00:00,-1001156495705,
2024-11-05 10:09:02+00:00,-1001156495705,"Momentum Trading Pick: Oct 2024 PerformanceðŸ“Š

Maximizing Returns with Precision-Driven, Momentum Picks

At Momentum Pick, we focus on identifying stocks with strong quarterly results and an upward price trend. Our approach combines fundamental insights with technical indicators, helping us find companies with solid earnings and steady growth. By using this method, we have a track record of spotting top-performing sectorsâ€”like construction equipment makers in Q3FY24, auto parts manufacturers in Q4FY24, and pharmaceutical and consumer goods companies in Q1FY25.
This reliable strategy allows us to find new opportunities in any market environment, aiming to deliver the best possible returns to you. Weâ€™re committed to keeping you informed, so letâ€™s take a look at our recent stock recommendations

With the release of Q2FY25 results, several companies have met our fundamental selection criteria. However, due to current market conditions, the momentum criteria are yet to be fully realized for some stocks. Nevertheless, weâ€™ve initiated a few fresh recommendations based on Q2FY25 performance, including Manorama Industries, Persistent Systems, Sun Pharma, and Poly Medicure.

Recent market volatility has triggered stop-losses for some of our previous recommendations, such as KPIT Tech, Rattan India, and Selan Exploration, despite KPIT Tech and Selan posting robust Q2FY25 results.

Our recommendations based on Q2FY25 results have shown strong performance, with notable gains in:
â€¢ Poly Medicure: +16.28% (in 2 days)
â€¢ Manorama Industries: +7.21% (in 3 days)

While these gains underscore the strength of our approach, a few stocks underperformed, with Persistent Systems and Sun Pharma experiencing losses of 4.5% and 0.59%, respectively.

Additionally, CAMS, a recommendation from February 2024, continues to merit holding for another quarter due to its consistent, high-quality results, delivering a return of 56.33% to date.

Despite some challenges, our Q2FY25-based recommendations have achieved an average return of 4.6%, demonstrating the resilience and adaptability of our strategy.

Despite recent market challenges, our live trades since their respective recommendation dates have achieved an average return of 7.23%, translating to an impressive annualized return of 35.07%. This performance underscores the resilience and effectiveness of our strategy. However, the average return of all open recommendations from previous months in October 2024 was -3.23%, reflecting the impact of broader market conditions during the month."
2024-11-05 09:06:33+00:00,-1001156495705,"RECOMMENDATION ALERT ðŸ””

Stock Name: Marksans Pharma Ltd
Symbol: MARKSANS
Rating: Buy ðŸŸ¢
CMP: â‚¹293
Stop loss: â‚¹278
Target: 344
Duration: 5-10 Days
Trade Date: 05-11-2024
Trade Type: Short-Term Trade
Name of RA: Om Mehra

Disclaimer: https://sam-co.in/6j/ Samco Securities Ltd"
2024-11-05 06:14:55+00:00,-1001156495705,"RECOMMENDATION ALERT ðŸ””

Stock Name: Pidilite Industries Ltd
Symbol: PIDILITIND24NOV3100PE
Rating: Buy ðŸŸ¢
CMP: â‚¹67
Stop loss: â‚¹53
Target: 93
Duration: 1-2 Days
Trade Date: 05-11-2024
Trade Type: Positional Stock Option
Name of RA: Om Mehra

Disclaimer: https://sam-co.in/6j/ Samco Securities Ltd"
2024-11-05 05:24:41+00:00,-1001156495705,EXIT CMP 186
2024-11-05 05:02:41+00:00,-1001156495705,"RECOMMENDATION ALERT ðŸ””

Stock Name: NIFTY
Symbol: NIFTY24N0724000CE
Rating: Buy ðŸŸ¢
CMP: â‚¹170
Stop loss: â‚¹150
Target: 250
Duration: INTRADAY
Trade Date: 05-11-2024
Trade Type: Intraday Call
Name of RA: Dhupesh Dhameja

Disclaimer: https://sam-co.in/6j/ Samco Securities Ltd"
2024-11-05 04:29:40+00:00,-1001156495705,EXIT SL HIT CMP 220
2024-11-05 04:20:39+00:00,-1001156495705,"RECOMMENDATION ALERT ðŸ””

Stock Name: NIFTY
Symbol: NIFTY24N0724100PE
Rating: Buy ðŸŸ¢
CMP: â‚¹255
Stop loss: â‚¹220
Target: 320
Duration: INTRADAY
Trade Date: 05-11-2024
Trade Type: Intraday Call
Name of RA: Dhupesh Dhameja

Disclaimer: https://sam-co.in/6j/ Samco Securities Ltd"
2024-11-05 03:54:41+00:00,-1001156495705,"RECOMMENDATION ALERT ðŸ””

Stock Name: Gufic BioSciences Ltd
Symbol: GUFICBIO
Rating: Buy ðŸŸ¢
CMP: â‚¹470
Stop loss: â‚¹440
Target: 540
Duration: 5-10 Days
Trade Date: 05-11-2024
Trade Type: Short-Term Trade
Name of RA: Om Mehra

Disclaimer: https://sam-co.in/6j/ Samco Securities Ltd"
2024-11-05 02:53:10+00:00,-1001156495705,Traders Dashboard
2024-11-04 10:04:57+00:00,-1001156495705,"Automobiles Sales Volume Growth in October 2024: Eicher Motors and M&M Shines ðŸŒŸ

In October 2024, while 2W OEMs recorded growth in sales volume, PV and CV OEMs showed mixed performance 

In the 2W segment, Eicher Motors' brand Royal Enfield reached an all-time festive high, surpassing the 1,00,000 sales milestoneðŸ

In the PV&CV segments, Maruti Suzuki sold over 2,00,000 units and M&M achieved robust sales volume growth of 19.8% YoYðŸ”¼

Stay updated, visit ðŸ‘‰  http://sam-co.in/samte"
2024-11-04 08:44:56+00:00,-1001156495705,"US Bond Yield Spike Triggers Nifty Downturn - Will the Trend Continue or Reverse?ðŸ¤”

Stay updated, visit ðŸ‘‰  http://sam-co.in/samte"
2024-11-04 07:44:00+00:00,-1001156495705,"Seasonality Analysis: Voltas Ltd ðŸ“Š

Voltas' performance remains solid, with strong seasonal demand and effective operations supporting positive returnsðŸ“ˆ

Stay updated, visit ðŸ‘‰  http://sam-co.in/samte"
2024-11-04 04:00:08+00:00,-1001156495705,Target Achieved
2024-11-04 03:03:45+00:00,-1001156495705,Traders Dashboard
2024-11-03 06:03:02+00:00,-1001156495705,"On this Bhai Dooj, celebrate the bonds that grow stronger over time. Wishing you a prosperous Bhai Dooj from all of us at Samco!"
2024-11-01 13:08:41+00:00,-1001156495705,"Begin your Muhurat Trading with blessings and insights! Start your trading journey today with our #PujaKiThaliInsightsWali virtual Laxmi Puja. 

To know more, click ðŸ‘‰
https://tinyurl.com/4dpemu58"
2024-10-31 07:40:38+00:00,-1001156495705,"Larsen & Toubro: Rising Sales And PAT With Stable Margins ðŸ“ˆ

Stay updated, visit ðŸ‘‰  http://sam-co.in/samte"
2024-10-31 06:40:33+00:00,-1001156495705,Book Profit and Exit @ 100
2024-10-31 06:01:14+00:00,-1001156495705,"RECOMMENDATION ALERT ðŸ””

Stock Name: Lupin Ltd
Symbol: LUPIN24NOV2180PE
Rating: Buy ðŸŸ¢
CMP: â‚¹95
Stop loss: â‚¹87
Target: 112
Duration: 1-2 Days
Trade Date: 31-10-2024
Trade Type: Positional Stock Option
Name of RA: Om Mehra

Disclaimer: https://sam-co.in/6j/ Samco Securities Ltd"
2024-10-31 05:06:13+00:00,-1001156495705,"Seasonality Analysis: Suntv Network LtdðŸ“Š

Sun TV's stock has been under pressure, affected by competition and shifts in the media landscape. 

Stay updated, visit ðŸ‘‰ http://sam-co.in/samte"
2024-10-31 04:03:27+00:00,-1001156495705,"As you light up your home this festive season, donâ€™t forget to brighten up your trading game. Happy Diwali from Samco!"
2024-10-31 03:52:48+00:00,-1001156495705,Exit @ 35.3
2024-10-30 10:26:52+00:00,-1001156495705,We are live ðŸ”´ ðŸ‘‰ https://www.youtube.com/live/GshBcYwjUEE?si=1eUN1i_NvWYbjdd9
2024-10-30 08:14:48+00:00,-1001156495705,"eMudhra Ltd Q2FY25 Result: Roaring Revenue Growth, Soaring Share Price! ðŸ“ˆ

Stay updated, visit ðŸ‘‰ http://sam-co.in/samte"
2024-10-30 06:26:54+00:00,-1001156495705,"Seasonality Analysis: BHELðŸ“Š

BHEL's returns have declined, affected by demand shifts and sector competitionðŸ”½

Stay updated, visit ðŸ‘‰ http://sam-co.in/samte"
2024-10-30 05:28:16+00:00,-1001156495705,"RECOMMENDATION ALERT ðŸ””

Stock Name: Poly Medicure Ltd
Symbol: POLYMED
Rating: Buy ðŸŸ¢
CMP: â‚¹2690
Stop loss: â‚¹2152
Duration: 6 Months
Trade Date: 30-10-2024
Trade Type: Momentum Pick

Note: Since we base our strategy on earnings and momentum, predicting the target price might lead to early exits. So, we will update the exit price as soon as the stock loses its momentum or becomes technically weak. Until then enjoy the ride. The ideal holding period for this call is six months.

Name of RA: T Manish

Disclaimer: https://sam-co.in/6j/ Samco Securities Ltd"
2024-10-30 04:53:35+00:00,-1001156495705,"RECOMMENDATION ALERT ðŸ””

Stock Name: Gillette India Limited
Symbol: GILLETTE
Rating: Buy ðŸŸ¢
CMP: â‚¹9685
Stop loss: â‚¹7748
Duration: 1 Year
Trade Date: 30-10-2024
Trade Type: Positional Pick

Note: Since we base our strategy on momentum, predicting the target price might lead to early exits. So, we will update the exit price as soon as the momentum slows down. The maximum holding period for this call is one year.

Name of RA: Amar Nandu

Disclaimer: https://sam-co.in/6j/ Samco Securities Ltd"
2024-10-30 04:52:07+00:00,-1001156495705,"RECOMMENDATION ALERT ðŸ””

Stock Name: JSW Steel Ltd
Symbol: JSWSTEEL24NOV960CE
Rating: Buy ðŸŸ¢
CMP: â‚¹35
Stop loss: â‚¹30
Target: 44
Duration: 1-2 Days
Trade Date: 30-10-2024
Trade Type: Positional Stock Option
Name of RA: Om Mehra

Disclaimer: https://sam-co.in/6j/ Samco Securities Ltd"
2024-10-30 04:07:38+00:00,-1001156495705,"RECOMMENDATION ALERT ðŸ””

Stock Name: Poly Medicure Ltd
Symbol: POLYMED
Rating: Buy ðŸŸ¢
CMP: â‚¹2722
Stop loss: â‚¹2610
Target: 3040
Duration: 5-10 Days
Trade Date: 30-10-2024
Trade Type: Short-Term Trade
Name of RA: Om Mehra

Disclaimer: https://sam-co.in/6j/ Samco Securities Ltd"
2024-10-30 03:55:32+00:00,-1001156495705,Exit @ 3954
2024-10-30 02:52:35+00:00,-1001156495705,Traders Dashboard
2024-10-29 08:25:00+00:00,-1001156495705,"Close Position, SL Triggered"
2024-10-29 08:10:59+00:00,-1001156495705,"Elcid Investments Surpasses MRFâ€™s Price, Soars 66,92,535% in a Single Day!ðŸš€

Elcid Investments Ltd. made stock market history on October 29, 2024, with a staggering 6.7 million percent increase in a single dayðŸ“ˆ

Stay updated, visit ðŸ‘‰ http://sam-co.in/samte"
2024-10-29 07:11:44+00:00,-1001156495705,"IOCL Q2 FY25: Weak Operating Profit Margin Drives Losses, Stock Down 3%ðŸ“‰

In Q2 FY25, Indian Oil Corporation delivered weak financial resultsðŸ“‰

The company reported a net loss of â‚¹448.78 Cr for the quarter, with the owner's share of the loss being â‚¹169.58 CrðŸ™

The OPM has been declining for last four quarters, reaching just 2% this quarter, significantly contributing to the drop in profitabilityðŸ“Š
 
Stay updated, visit ðŸ‘‰ http://sam-co.in/samte"
2024-10-29 05:56:20+00:00,-1001156495705,"RECOMMENDATION ALERT ðŸ””

Stock Name: Sun Pharmaceuticals Industries Ltd
Symbol: SUNPHARMA
Rating: Buy ðŸŸ¢
CMP: â‚¹1869
Stop loss: â‚¹1498
Duration: 6 Months
Trade Date: 29-10-2024
Trade Type: Momentum Pick

Note: Since we base our strategy on earnings and momentum, predicting the target price might lead to early exits. So, we will update the exit price as soon as the stock loses its momentum or becomes technically weak. Until then enjoy the ride. The ideal holding period for this call is six months.

Name of RA: T Manish

Disclaimer: https://sam-co.in/6j/ Samco Securities Ltd"
2024-10-29 05:20:03+00:00,-1001156495705,TARGET ACHIEVED CMP 175
2024-10-29 05:07:29+00:00,-1001156495705,"RECOMMENDATION ALERT ðŸ””

Stock Name: MIDCAPNIFTY
Symbol: MIDCPNIFTY24N0412400PE
Rating: Buy ðŸŸ¢
CMP: â‚¹140
Stop loss: â‚¹125
Target: 170
Duration: INTRADAY
Trade Date: 30-11--0001
Trade Type: Intraday Call
Name of RA: Dhupesh Dhameja

Disclaimer: https://sam-co.in/6j/ Samco Securities Ltd"
2024-10-29 04:05:06+00:00,-1001156495705,"Seasonality Analysis: Apollo Hospitals ðŸ¥

Apollo Hospitals continues to show resilience and growth, driven by high healthcare demand and expansion

Stay updated, visit ðŸ‘‰ http://sam-co.in/samte"
2024-10-29 02:50:45+00:00,-1001156495705,Traders Dashboard
2024-10-28 08:46:44+00:00,-1001156495705,"RECOMMENDATION ALERT ðŸ””

Stock Name: HDFC Bank Ltd
Symbol: HDFCBANK24NOV1740PE
Rating: Buy ðŸŸ¢
CMP: â‚¹38.2
Stop loss: â‚¹32
Target: 48
Duration: 1-2 Days
Trade Date: 28-10-2024
Trade Type: Positional Stock Option
Name of RA: Om Mehra

Disclaimer: https://sam-co.in/6j/ Samco Securities Ltd"
2024-10-28 08:32:31+00:00,-1001156495705,"ICICI Bank Q2FY25 Result: PAT Rise 19% YoY, Share Price Surged 4%ðŸ“ˆ

Here's How ICICI Bank performed in Q2FY25ðŸ“Š

Stay updated, visit ðŸ‘‰ http://sam-co.in/samte"
2024-10-28 07:24:13+00:00,-1001156495705,Book Profit and Exit @ 40
2024-10-28 07:08:39+00:00,-1001156495705,"Seasonality Analysis: Punjab National BankðŸ“Š

PNBâ€™s improved asset quality and strategic initiatives have contributed to its steady positive returnsðŸ“ˆ

Stay updated, visit ðŸ‘‰ http://sam-co.in/samte"
2024-10-28 06:32:49+00:00,-1001156495705,"RECOMMENDATION ALERT ðŸ””

Stock Name: Kotak Mahindra Bank Ltd
Symbol: KOTAKBANK24NOV1760PE
Rating: Buy ðŸŸ¢
CMP: â‚¹36
Stop loss: â‚¹28
Target: 48
Duration: 1-2 Days
Trade Date: 28-10-2024
Trade Type: Positional Stock Option
Name of RA: Om Mehra

Disclaimer: https://sam-co.in/6j/ Samco Securities Ltd"
2024-10-28 04:03:19+00:00,-1001156495705,
2024-10-28 04:03:06+00:00,-1001156495705,
2024-10-28 02:56:05+00:00,-1001156495705,Traders Dashboard
2024-10-27 12:41:11+00:00,-1001156495705,
2024-10-26 06:35:23+00:00,-1001156495705,https://youtu.be/G8BTe3O99Aw?si=6pKx6nrEQiH62EVD
2024-10-25 10:58:08+00:00,-1001156495705,"As you gear up for the festive season, get your blessings & stock recommendations in one go with Samcoâ€™s #PujaKiThaliInsightsWali

Complete the virtual puja and start Muhurat Trading on an auspicious note 

To know more ðŸ‘‰ðŸ» https://tinyurl.com/4dpemu58"
2024-10-25 10:08:51+00:00,-1001156495705,"Q2 Result Highlights for Industrial Gases & Gas Transmission CompaniesðŸ“Š

ADANI TOTAL GAS LTD reported revenue and profit growth in Q2 FY25 on both a YoY & QoQ basisðŸ“ˆ

PETRONET LNG LTD's revenue and profit increased on a YoY basis but declined on a QoQ basis 

While MAHANAGAR GAS LTD's revenue increased on both a YoY and QoQ basis during Q2, its profit declined on both basesðŸ˜²

Stay updated, visit ðŸ‘‰ http://sam-co.in/samte"
2024-10-25 07:55:48+00:00,-1001156495705,https://youtu.be/U3uLmXhHnes
2024-10-25 07:12:22+00:00,-1001156495705,"Trading Alert ðŸ“¢

Bharti Airtel has moved below the 20-day moving average. A divergence in the daily RSI and weakening momentum indicate a further downside trajectory. 

For trading alerts, visit ðŸ‘‰ http://sam-co.in/samte"
2024-10-25 06:07:45+00:00,-1001156495705,"Seasonality Analysis: Samvardhana Motherson International ðŸ“Š

Mothersonâ€™s global reach and strong industry positioning have led to consistent stock growth

Stay updated, visit ðŸ‘‰ http://sam-co.in/samte"
2024-10-25 04:57:03+00:00,-1001156495705,Exit @ 1915
2024-10-25 04:37:14+00:00,-1001156495705,"Seasonality Analysis: Tata Motors ðŸš—

Tata Motors has consistently delivered positive returns, driven by innovation and strong market demand ðŸ”¼

Stay updated, visit ðŸ‘‰ http://sam-co.in/samte"
2024-10-25 03:04:43+00:00,-1001156495705,Traders Dashboard
2024-10-24 11:30:30+00:00,-1001156495705,https://youtu.be/9o2R-fSmMDE
2024-10-24 09:33:23+00:00,-1001156495705,Exit @ 71
2024-10-24 09:05:58+00:00,-1001156495705,"TVS Motor Q2 Results: PAT 40%+ YoY, But Stock Falls Over 5% in Two DaysðŸ“‰

In Q2 FY25, TVS Motor has sold 12.28 lakh vehicles and reported 13.8% YoY increase in revenueðŸ“ˆ

Its net profit (ownerâ€™s share) has also increased strongly by 45.1% YoY in Q2ðŸ”¼ 

However, the stock price fell yesterday (result day) by 3.74% and today by 2.25%ðŸ”½ 

Stay updated, visit ðŸ‘‰ http://sam-co.in/samte"
2024-10-24 07:56:31+00:00,-1001156495705,"RECOMMENDATION ALERT ðŸ””

Stock Name: Hero MotoCorp Ltd
Symbol: HEROMOTOCO24OCT5100PE
Rating: Buy ðŸŸ¢
CMP: â‚¹79
Stop loss: â‚¹64
Target: 108
Duration: 1-2 Days
Trade Date: 24-10-2024
Trade Type: Positional Stock Option
Name of RA: Om Mehra

Disclaimer: https://sam-co.in/6j/ Samco Securities Ltd"
2024-10-24 07:28:19+00:00,-1001156495705,EXIT CMP 191.50
2024-10-24 07:13:44+00:00,-1001156495705,"Trading Alert ðŸ“¢

HDFC Bank sees a multi-year Ascending Triangle breakout, holding above the 20-week EMA with rising volumes and RSI above 60, signaling strong bullish momentum

Stay updated, visit ðŸ‘‰ http://sam-co.in/samte"
2024-10-24 05:57:58+00:00,-1001156495705,"RECOMMENDATION ALERT ðŸ””

Stock Name: Neogen Chemicals Ltd
Symbol: NEOGEN
Rating: Buy ðŸŸ¢
CMP: â‚¹2000
Stop loss: â‚¹1880
Target: 2340
Duration: 5-10 Days
Trade Date: 24-10-2024
Trade Type: Short-Term Trade
Name of RA: Om Mehra

Disclaimer: https://sam-co.in/6j/ Samco Securities Ltd"
2024-10-24 05:52:23+00:00,-1001156495705,"RECOMMENDATION ALERT ðŸ””

Stock Name: Deepak Fertilisers And Petrochemicals Corporation Ltd
Symbol: DEEPAKFERT
Rating: Buy ðŸŸ¢
CMP: â‚¹1124
Stop loss: â‚¹899
Duration: 1 Year
Trade Date: 24-10-2024
Trade Type: Positional Pick

Note: Since we base our strategy on momentum, predicting the target price might lead to early exits. So, we will update the exit price as soon as the momentum slows down. The maximum holding period for this call is one year.

Name of RA: Amar Nandu

Disclaimer: https://sam-co.in/6j/ Samco Securities Ltd"
2024-10-24 05:41:26+00:00,-1001156495705,"RECOMMENDATION ALERT ðŸ””

Stock Name: NIFTY
Symbol: NIFTY24OCT24500PE
Rating: Buy ðŸŸ¢
CMP: â‚¹180
Stop loss: â‚¹160
Target: 240
Duration: INTRADAY
Trade Date: 24-10-2024
Trade Type: Intraday Call
Name of RA: Dhupesh Dhameja

Disclaimer: https://sam-co.in/6j/ Samco Securities Ltd"
2024-10-24 05:21:07+00:00,-1001156495705,"RECOMMENDATION ALERT ðŸ””

Stock Name: Persistent Systems Ltd
Symbol: PERSISTENT
Rating: Buy ðŸŸ¢
CMP: â‚¹5643
Stop loss: â‚¹4514
Duration: 6 Months
Trade Date: 24-10-2024
Trade Type: Momentum Pick

Note: Since we base our strategy on earnings and momentum, predicting the target price might lead to early exits. So, we will update the exit price as soon as the stock loses its momentum or becomes technically weak. Until then enjoy the ride. The ideal holding period for this call is six months.

Name of RA: T Manish

Disclaimer: https://sam-co.in/6j/ Samco Securities Ltd"
2024-10-24 05:09:28+00:00,-1001156495705,
2024-10-24 04:31:19+00:00,-1001156495705,"We recommended Selan Explorations Technology Ltd as it posted its highest-ever sales and PAT in Q1FY25 and recorded a decent YoY growth. The stock was also trading close to its previous highs.

Despite the company recording such stellar results, the stock lost momentum and continuous market wide fall has led the stock to hit its stop loss.
So, we are recommending to exit at Rs. 792 with a loss of 20%.

Feel free to share your thoughts on the suggested recommendations. You can write to us on support@samco.in"
2024-10-24 04:17:15+00:00,-1001156495705,"Book 85% Profit in Bombay Burmah Trading Corporation Ltd

CMP: â‚¹ 2704  
Returns: 85.21%
Recommended Price: â‚¹ 1460
Recommendation Date: 23-10-2023

Bombay Burmah Trading Corporation Limited (BBTCL), a flagship Company of Wadia Group was founded in the year 1863. BBTCL, today, has a presence in diversified business of Tea, Coffee, other plantation products, Biscuits, Dairy products, Auto electric and White goods, weighing products, horticulture, Healthcare products, Dental, orthopaedic and ophthalmic products.

We have completed the one-year holding period with this stock under the Positional Trading Pick. According to the strategy rules, we recommend investors to sell the stock and book 85% profit.

Name of RA: Amar Nandu

Disclaimer: https://sam-co.in/6j/ Samco Securities Ltd"
2024-10-24 02:57:03+00:00,-1001156495705,Traders Dashboard
2024-10-23 10:28:26+00:00,-1001156495705,We are live ðŸ”´ ðŸ‘‰  https://youtube.com/live/RfwXA2hNrcE
2024-10-23 09:14:12+00:00,-1001156495705,
2024-10-23 09:13:55+00:00,-1001156495705,"FSL has given a breakout from its resistance zone of 340-345 level on the daily chart supported by rise in trading volumes. 

Disclaimer: https://sam-co.in/6j"
2024-10-23 06:46:59+00:00,-1001156495705,"Seasonality Analysis: Grasim IndustriesðŸ“Š

Grasim's diverse portfolio and operational efficiency have consistently fueled positive stock returnsðŸ“ˆ

Stay updated, visit ðŸ‘‰ http://sam-co.in/samte"
2024-10-23 06:15:17+00:00,-1001156495705,"RECOMMENDATION ALERT ðŸ””

Stock Name: Avenue Supermarts Ltd
Symbol: DMART
Rating: Buy ðŸŸ¢
CMP: â‚¹4070
Stop loss: â‚¹3870
Target: 4400
Duration: 5-10 Days
Trade Date: 23-10-2024
Trade Type: Short-Term Trade
Name of RA: Om Mehra

Disclaimer: https://sam-co.in/6j/ Samco Securities Ltd"
2024-10-23 03:00:17+00:00,-1001156495705,Traders Dashboard
2024-10-22 08:14:37+00:00,-1001156495705,"Falling Sales and Falling Margins For Ultratech Cement in Q2FY25ðŸ“‰

Stay updated, visit ðŸ‘‰ http://sam-co.in/samte"
2024-10-22 07:03:06+00:00,-1001156495705,"Close Position, SL Triggered"
2024-10-22 06:43:16+00:00,-1001156495705,Exit @ 262
2024-10-22 06:16:06+00:00,-1001156495705,Book Profit and Exit @ 471
2024-10-22 05:32:46+00:00,-1001156495705,"Seasonality Analysis: Info Edge  

Info Edge's leadership in online recruitment and strategic investments have consistently driven positive stock performance â«

Stay updated, visit ðŸ‘‰ http://sam-co.in/samte"
2024-10-22 05:32:30+00:00,-1001156495705,"Exit from Jain Irrigation Systems Limited!

Jain Irrigation has hit our stop-loss level on October 22, 2024 leading us to exit the stock due to significant selling pressure amid highly volatile markets."
2024-10-22 04:34:04+00:00,-1001156495705,BOOK PROFIT CMP 232
2024-10-22 04:15:44+00:00,-1001156495705,"RECOMMENDATION ALERT ðŸ””

Stock Name: NIFTY
Symbol: NIFTY24O2424700CE
Rating: Buy ðŸŸ¢
CMP: â‚¹180
Stop loss: â‚¹155
Target: 250
Duration: INTRADAY
Trade Date: 22-10-2024
Trade Type: Intraday Call
Name of RA: Dhupesh Dhameja

Disclaimer: https://sam-co.in/6j/ Samco Securities Ltd"
2024-10-22 03:57:12+00:00,-1001156495705,
2024-10-22 03:56:51+00:00,-1001156495705,
2024-10-22 02:51:59+00:00,-1001156495705,Traders Dashboard
2024-10-21 12:22:33+00:00,-1001156495705,https://youtu.be/aw9iTTZLQ0A
2024-10-21 06:32:52+00:00,-1001156495705,"Oberoi Realty: Strong Sales and Higher Margins Drives The Surge In StockðŸ“ˆ

The chart displays the financial highlights of Oberoi Realty for Q2FY25ðŸ“Š

Stay updated, visit ðŸ‘‰ http://sam-co.in/samte"
2024-10-21 06:11:39+00:00,-1001156495705,"RECOMMENDATION ALERT ðŸ””

Stock Name: EPL Ltd
Symbol: EPL
Rating: Buy ðŸŸ¢
CMP: â‚¹274
Stop loss: â‚¹260
Target: 302
Duration: 5-10 Days
Trade Date: 21-10-2024
Trade Type: Short-Term Trade
Name of RA: Om Mehra

Disclaimer: https://sam-co.in/6j/ Samco Securities Ltd"
2024-10-21 05:58:50+00:00,-1001156495705,EXIT SL HIT CMP 50
2024-10-21 04:37:38+00:00,-1001156495705,"RECOMMENDATION ALERT ðŸ””

Stock Name: FINNIFTY
Symbol: FINNIFTY24O2224100CE
Rating: Buy ðŸŸ¢
CMP: â‚¹85
Stop loss: â‚¹50
Target: 140
Duration: INTRADAY
Trade Date: 21-10-2024
Trade Type: Intraday Call
Name of RA: Dhupesh Dhameja

Disclaimer: https://sam-co.in/6j/ Samco Securities Ltd"
2024-10-21 02:44:42+00:00,-1001156495705,Traders Dashboard
2024-10-20 11:49:04+00:00,-1001156495705,
2024-10-19 05:32:01+00:00,-1001156495705,https://youtu.be/vWvcbRxSejQv
2024-10-18 12:31:41+00:00,-1001156495705,"Join us tomorrow at 11 a.m., where Apurva Sheth is in conversation with Rishabh Nahar to address ""All Weather Investing"" 

Don't forget to see this episode exclusively on The Right Choices with the Oracles of Dalal Street"
2024-10-18 11:36:32+00:00,-1001156495705,
2024-10-18 09:04:35+00:00,-1001156495705,"IGL and MGL Shares Drop Over 10% Amid APM Gas Allocation Cutsâ›½ï¸

IGL and MGL have announced that the GAIL, the nodal agency for gas distribution under APM, has reduced their gas allocation by ~21% and ~20%, respectivelyðŸ”½ 

This reduction is expected to negatively impact the profitability of both companiesðŸ“Š

Due to this negative news, the share prices of both IGL and MGL have fallen by over 10% todayðŸ“‰

Stay updated, visit ðŸ‘‰ http://sam-co.in/samte"
2024-10-18 09:03:37+00:00,-1001156495705,Book Profit and Exit @ 1289
2024-10-18 06:56:08+00:00,-1001156495705,"Seasonality Analysis: India Cement ðŸ“Š

India Cement has faced challenges, with negative returns driven by weak demand and rising costs.

Stay updated, visit ðŸ‘‰ http://sam-co.in/samte"
2024-10-18 06:51:01+00:00,-1001156495705,TARGET ACHIEVED IN 24600CE
2024-10-18 05:41:33+00:00,-1001156495705,"Trading Alert ðŸ“¢

CDSL displays higher highs and higher lows indicating a sustained uptrend. CDSL bullish momentum is evident as the 10-day Simple Moving Average has crossed above the 20 SMA which signifies a strengthening trend.

Stay updated, visit ðŸ‘‰ http://sam-co.in/samte"
2024-10-18 05:01:21+00:00,-1001156495705,"RECOMMENDATION ALERT ðŸ””

Stock Name: NIFTY
Symbol: NIFTY24O2424600CE
Rating: Buy ðŸŸ¢
CMP: â‚¹225
Stop loss: â‚¹190
Target: 270
Duration: INTRADAY
Trade Date: 18-10-2024
Trade Type: Intraday Call
Name of RA: Dhupesh Dhameja

Disclaimer: https://sam-co.in/6j/ Samco Securities Ltd"
2024-10-18 04:47:45+00:00,-1001156495705,Close Position @ 372
2024-10-18 04:04:00+00:00,-1001156495705,"Exit Alok Industries Ltd 
Returns: (-20%)


Due to the weak Q2 results, the share price has corrected in the past few days. Ultimately, the value has dipped by 20% from our entry point, triggering our pre-established stop loss.

Investors should follow the rules set by the system, cutting losers early and letting winners run."
2024-10-18 03:40:22+00:00,-1001156495705,
2024-10-18 02:50:41+00:00,-1001156495705,Traders Dashboard
2024-10-17 08:49:27+00:00,-1001156495705,"RECOMMENDATION ALERT ðŸ””

Stock Name: Aurobindo Pharma Ltd
Symbol: AUROPHARMA24OCT1480PE
Rating: Buy ðŸŸ¢
CMP: â‚¹29
Stop loss: â‚¹21
Target: 46
Duration: 1-2 Days
Trade Date: 17-10-2024
Trade Type: Positional Stock Option
Name of RA: Om Mehra

Disclaimer: https://sam-co.in/6j/ Samco Securities Ltd"
2024-10-17 08:29:40+00:00,-1001156495705,"EXIT CMP 2,90"
2024-10-17 06:50:49+00:00,-1001156495705,"RECOMMENDATION ALERT ðŸ””

Stock Name: NIFTY
Symbol: NIFTY24O1724850CE
Rating: Buy ðŸŸ¢
CMP: â‚¹8
Stop loss: â‚¹1
Target: 30
Duration: INTRADAY
Trade Date: 17-10-2024
Trade Type: Intraday Call
Name of RA: Dhupesh Dhameja

Disclaimer: https://sam-co.in/6j/ Samco Securities Ltd"
2024-10-17 06:17:54+00:00,-1001156495705,"Bajaj Autoâ€™s Consolidated Profit Slumped in Q2 FY25, Stock Down 11% TodayðŸ“‰

Bajaj Auto reported 22.2% YoY increase in revenue during Q2 FY25, however, its profit fell by 31.4% YoY

Share of loss of â‚¹580 Cr from associate (six monthsâ€™ loss booked in Q2) played a key role in downfall of Q2 performanceðŸ“‰

Bajaj Autoâ€™s stock has fallen over 11% today, as the market gets disappointed. However, it has reported the profit growth in standalone booksðŸ“Š

Stay updated, visit ðŸ‘‰ http://sam-co.in/samte"
2024-10-17 05:29:49+00:00,-1001156495705,"RECOMMENDATION ALERT ðŸ””

Stock Name: Aegis Logistics Ltd
Symbol: AEGISLOG
Rating: Buy ðŸŸ¢
CMP: â‚¹732
Stop loss: â‚¹697
Target: 795
Duration: 5-10 Days
Trade Date: 17-10-2024
Trade Type: Short-Term Trade
Name of RA: Om Mehra

Disclaimer: https://sam-co.in/6j/ Samco Securities Ltd"
2024-10-17 04:20:25+00:00,-1001156495705,"Seasonality Analysis: Gujarat State Petronet LtdðŸ“Š

GSPL has consistently shown positive returns, driven by rising demand for natural gas and operational efficiencyðŸ”¥ðŸ’¼

Stay updated, visit ðŸ‘‰ http://sam-co.in/samte"
2024-10-17 03:42:01+00:00,-1001156495705,
2024-10-17 02:50:06+00:00,-1001156495705,Traders Dashboard
2024-10-16 11:37:17+00:00,-1001156495705,
2024-10-16 10:33:17+00:00,-1001156495705,We are live ðŸ”´ ðŸ‘‰ https://youtube.com/live/XZmP3q6vI8g
2024-10-16 09:50:03+00:00,-1001156495705,Book Profit and Exit @ 14.6
2024-10-16 08:45:50+00:00,-1001156495705,
2024-10-16 08:45:21+00:00,-1001156495705,"HDFCAMC has given a breakout from the resistance zones of 4,530-4,540 levels on the daily chart supported by rise in daily volumes.  

Disclaimer: https://sam-co.in/6j"
2024-10-16 08:29:11+00:00,-1001156495705,Revise SL to 372
2024-10-16 05:59:28+00:00,-1001156495705,Book Profit and Exit @ 228.4
2024-10-16 05:07:02+00:00,-1001156495705,"Seasonality Analysis: Ajanta PharmaðŸ’Š

Ajanta Pharma has shown consistent positive returns, driven by strong demand and innovationðŸ“ˆ

Stay updated, visit ðŸ‘‰ http://sam-co.in/samte"
2024-10-16 04:54:32+00:00,-1001156495705,Exit @ 15
2024-10-16 04:48:44+00:00,-1001156495705,"RECOMMENDATION ALERT ðŸ””

Stock Name: Motilal Oswal Financial Services Limited
Symbol: MOTILALOFS
Rating: Buy ðŸŸ¢
CMP: â‚¹946
Stop loss: â‚¹757
Duration: 1 Year
Trade Date: 16-10-2024
Trade Type: Positional Pick

Note: Since we base our strategy on momentum, predicting the target price might lead to early exits. So, we will update the exit price as soon as the momentum slows down. The maximum holding period for this call is one year.

Name of RA: Amar Nandu

Disclaimer: https://sam-co.in/6j/ Samco Securities Ltd"
2024-10-16 03:42:28+00:00,-1001156495705,
2024-10-16 02:49:32+00:00,-1001156495705,Traders Dashboard
2024-10-15 11:37:27+00:00,-1001156495705,
2024-10-15 09:41:46+00:00,-1001156495705,
2024-10-15 09:41:23+00:00,-1001156495705,"FIVESTAR has given a breakout from its resistance level of 865-875 on the daily chart supported by rise in volumes. 

Disclaimer: https://sam-co.in/6j"
2024-10-15 08:14:33+00:00,-1001156495705,"RECOMMENDATION ALERT ðŸ””

Stock Name: AU Small Finance Bank Ltd
Symbol: AUBANK24OCT690CE
Rating: Buy ðŸŸ¢
CMP: â‚¹17.7
Stop loss: â‚¹13.7
Target: 27.7
Duration: 1-2 Days
Trade Date: 15-10-2024
Trade Type: Positional Stock Option
Name of RA: Om Mehra

Disclaimer: https://sam-co.in/6j/ Samco Securities Ltd"
2024-10-15 08:07:45+00:00,-1001156495705,"Reliance Industries: Digital Segments Drive Growth Amid Challenges in Oil-to-Chemicals CompaniesðŸ“ˆ

The chart displays the financial highlights of Reliance Industries For Q2FY25ðŸ“Š

Stay updated, visit ðŸ‘‰ http://sam-co.in/samte"
2024-10-15 05:50:18+00:00,-1001156495705,"RECOMMENDATION ALERT ðŸ””

Stock Name: Dabur India Ltd
Symbol: DABUR24OCT570CE
Rating: Buy ðŸŸ¢
CMP: â‚¹10.7
Stop loss: â‚¹7.6
Target: 16
Duration: 1-2 Days
Trade Date: 15-10-2024
Trade Type: Positional Stock Option
Name of RA: Om Mehra

Disclaimer: https://sam-co.in/6j/ Samco Securities Ltd"
2024-10-15 03:37:49+00:00,-1001156495705,
2024-10-15 02:49:25+00:00,-1001156495705,Traders Dashboard
2024-10-14 11:39:56+00:00,-1001156495705,
2024-10-14 09:56:38+00:00,-1001156495705,"RECOMMENDATION ALERT ðŸ””

Stock Name: Anant Raj Ltd
Symbol: ANANTRAJ
Rating: Buy ðŸŸ¢
CMP: â‚¹765
Stop loss: â‚¹728
Target: 858
Duration: 5-10 Days
Trade Date: 14-10-2024
Trade Type: Short-Term Trade
Name of RA: Om Mehra

Disclaimer: https://sam-co.in/6j/ Samco Securities Ltd"
2024-10-14 09:08:42+00:00,-1001156495705,
2024-10-14 09:08:30+00:00,-1001156495705,"OBEROIRLTY has given a breakout from its resistance zone of 1950-1970 on the daily chart supported by rise in trading volumes.  

Disclaimer: https://sam-co.in/6j"
2024-10-14 08:02:00+00:00,-1001156495705,"Close Position, SL Triggered i"
2024-10-14 07:04:57+00:00,-1001156495705,"Hathway Cable Record Quarterly Revenue Drives Surge in Share Price ðŸ“ˆ

The chart displays the financial highlights of Hathway Cable and Datacom for Q2FY25ðŸ“Š

Stay updated, visit ðŸ‘‰ http://sam-co.in/samte"
2024-10-14 06:47:43+00:00,-1001156495705,Book Profit and Exit @ 232
2024-10-14 06:32:00+00:00,-1001156495705,"Seasonality Analysis: Radico Khaitan ðŸ“Š

Radico has shown consistent positive returns during this period, reflecting strong market demand and steady growth

Stay updated, visit ðŸ‘‰ http://sam-co.in/samte"
2024-10-14 06:14:06+00:00,-1001156495705,"RECOMMENDATION ALERT ðŸ””

Stock Name: NIFTY
Symbol: NIFTY24O1725000CE
Rating: Buy ðŸŸ¢
CMP: â‚¹200
Stop loss: â‚¹175
Target: 260
Duration: INTRADAY
Trade Date: 14-10-2024
Trade Type: Intraday Call
Name of RA: Dhupesh Dhameja

Disclaimer: https://sam-co.in/6j/ Samco Securities Ltd"
2024-10-14 06:02:17+00:00,-1001156495705,"RECOMMENDATION ALERT ðŸ””

Stock Name: Narayana Hrudayalaya Ltd
Symbol: NH
Rating: Buy ðŸŸ¢
CMP: â‚¹1244
Stop loss: â‚¹1198
Target: 1310
Duration: 5-10 Days
Trade Date: 14-10-2024
Trade Type: Short-Term Trade
Name of RA: Om Mehra

Disclaimer: https://sam-co.in/6j/ Samco Securities Ltd"
2024-10-14 05:53:45+00:00,-1001156495705,https://youtu.be/8e9BKsVTetg
2024-10-14 05:28:12+00:00,-1001156495705,"RECOMMENDATION ALERT ðŸ””

Stock Name: Macrotech Developers Ltd
Symbol: LODHA
Rating: Buy ðŸŸ¢
CMP: â‚¹1189
Stop loss: â‚¹1148
Target: 1270
Duration: 5-10 Days
Trade Date: 14-10-2024
Trade Type: Short-Term Trade
Name of RA: Om Mehra

Disclaimer: https://sam-co.in/6j/ Samco Securities Ltd"
2024-10-14 05:21:29+00:00,-1001156495705,"RECOMMENDATION ALERT ðŸ””

Stock Name: Titan Company Ltd
Symbol: TITAN24OCT3500CE
Rating: Buy ðŸŸ¢
CMP: â‚¹76
Stop loss: â‚¹66
Target: 98
Duration: 1-2 Days
Trade Date: 14-10-2024
Trade Type: Positional Stock Option
Name of RA: Om Mehra

Disclaimer: https://sam-co.in/6j/ Samco Securities Ltd"
2024-10-14 04:36:02+00:00,-1001156495705,"RECOMMENDATION ALERT ðŸ””

Stock Name: Goldiam International Ltd
Symbol: GOLDIAM
Rating: Buy ðŸŸ¢
CMP: â‚¹368
Stop loss: â‚¹345
Target: 418
Duration: 5-10 Days
Trade Date: 14-10-2024
Trade Type: Short-Term Trade
Name of RA: Om Mehra

Disclaimer: https://sam-co.in/6j/ Samco Securities Ltd"
2024-10-14 03:41:52+00:00,-1001156495705,
2024-10-14 02:58:10+00:00,-1001156495705,Traders Dashboard
2024-10-13 11:40:24+00:00,-1001156495705,
2024-10-12 05:46:56+00:00,-1001156495705,"May you avoid these demons and reign victorious over the stock market, this Dussehra."
2024-10-11 12:31:59+00:00,-1001156495705,"Join us tomorrow at 11 a.m., where Apurva Sheth continues his conversation with Dharani Dharan address ""Mastering Options Trading By Automating Your Strategies""

Don't forget to see this episode exclusively on The Right Choices with the Oracles of Dalal Street"
2024-10-11 08:28:18+00:00,-1001156495705,"SIP Inflows, AAUM, and Folio Addition for Sept-2024: Sectoral/Thematic Funds ShineðŸŒŸ

Stay updated, visit ðŸ‘‰ http://sam-co.in/samte"
2024-10-11 07:14:25+00:00,-1001156495705,"Anand Rathi Wealth Q2FY25 Result: AUM Soared 57% YoY! ðŸš€

Stay updated, visit ðŸ‘‰  http://sam-co.in/samte"
2024-10-11 06:02:26+00:00,-1001156495705,BOOK PROFIT IN 25000PE CMP 189
2024-10-11 05:58:48+00:00,-1001156495705,"Seasonality Analysis: Punjab National BankðŸ“Š

PNB's positive returns signal recovery, aided by better asset quality and management

Stay updated, visit ðŸ‘‰ http://sam-co.in/samte"
2024-10-11 05:37:35+00:00,-1001156495705,"RECOMMENDATION ALERT ðŸ””

Stock Name: NIFTY
Symbol: NIFTY24O1725000PE
Rating: Buy ðŸŸ¢
CMP: â‚¹165
Stop loss: â‚¹135
Target: 230
Duration: INTRADAY
Trade Date: 11-10-2024
Trade Type: Intraday Call
Name of RA: Dhupesh Dhameja

Disclaimer: https://sam-co.in/6j/ Samco Securities Ltd"
2024-10-11 05:22:33+00:00,-1001156495705,BOOK PROFIT IN TATACOMM 2000CE CMP 55
2024-10-11 03:14:49+00:00,-1001156495705,Traders Dashboard
2024-10-10 08:25:02+00:00,-1001156495705,"RECOMMENDATION ALERT ðŸ””

Stock Name: Jagsonpal Pharmaceuticals Ltd
Symbol: JAGSNPHARM
Rating: Buy ðŸŸ¢
CMP: â‚¹460
Stop loss: â‚¹428
Target: 560
Duration: 5-10 Days
Trade Date: 10-10-2024
Trade Type: Short-Term Trade
Name of RA: Om Mehra

Disclaimer: https://sam-co.in/6j/ Samco Securities Ltd"
2024-10-10 06:51:33+00:00,-1001156495705,"Ratan Tataâ€™s Influence Lives On as Investors Rally Behind Tata GroupðŸŒŸ

The recent passing of Sir Ratan Tata has prompted not only an outpouring of tributes but also a marked increase in the share prices of Tata Group companies

Investors have rallied around TRF, Tata Investment, and Tata Power, perhaps viewing this as a way to honor a visionary leader whose contributions reshaped Indiaâ€™s industrial landscapeðŸ‡®ðŸ‡³

The stock surge reflects the marketâ€™s recognition of Tataâ€™s lasting influence, emphasizing investor confidence in the resilience, innovation, and ethical leadership he brought to the Tata GroupðŸ’¼âœ¨

Stay updated, visit ðŸ‘‰ http://sam-co.in/samte"
2024-10-10 06:37:45+00:00,-1001156495705,BOOK PROFIT IN 51100CE CMP 630
2024-10-10 06:21:17+00:00,-1001156495705,"RECOMMENDATION ALERT ðŸ””

Stock Name: BANKNIFTY
Symbol: BANKNIFTY16OCT2451100CE
Rating: Buy ðŸŸ¢
CMP: â‚¹542
Stop loss: â‚¹495
Target: 670
Duration: INTRADAY
Trade Date: 10-10-2024
Trade Type: Intraday Call
Name of RA: Dhupesh Dhameja

Disclaimer: https://sam-co.in/6j/ Samco Securities Ltd"
2024-10-10 05:57:55+00:00,-1001156495705,"RECOMMENDATION ALERT ðŸ””

Stock Name: Vindhya Telelinks Ltd
Symbol: VINDHYATEL
Rating: Buy ðŸŸ¢
CMP: â‚¹2,135
Duration: 1 Year
Trade Date: 10-10-2024
Trade Type: Value Pick

Note: Since we base our strategy on fundamental parameters, predicting the target price might lead to early exits. So, we will update the exit price as soon as the stock becomes overvalued. Until then hold the stock. The ideal holding period for this recommendation is one year.

Name of RA: Raj Gaikar

Disclaimer: https://sam-co.in/6j/ Samco Securities Ltd"
2024-10-10 04:30:09+00:00,-1001156495705,"RECOMMENDATION ALERT ðŸ””

Stock Name: Tata Communications Ltd
Symbol: TATACOMM24OCT2000CE
Rating: Buy ðŸŸ¢
CMP: â‚¹50
Stop loss: â‚¹40
Target: 76
Duration: 1-2 Days
Trade Date: 10-10-2024
Trade Type: Positional Stock Option
Name of RA: Om Mehra

Disclaimer: https://sam-co.in/6j/ Samco Securities Ltd"
2024-10-10 04:28:47+00:00,-1001156495705,EXIT SL HIT CMP 90
2024-10-10 04:25:38+00:00,-1001156495705,"RECOMMENDATION ALERT ðŸ””

Stock Name: NIFTY
Symbol: NIFTY24O1025100PE
Rating: Buy ðŸŸ¢
CMP: â‚¹120
Stop loss: â‚¹90
Target: 170
Duration: INTRADAY
Trade Date: 10-10-2024
Trade Type: Intraday Call
Name of RA: Dhupesh Dhameja

Disclaimer: https://sam-co.in/6j/ Samco Securities Ltd"
2024-10-10 04:12:40+00:00,-1001156495705,"Seasonality Analysis: Infosys Ltd ðŸ“Š

Infosys has experienced negative returns during this period, facing short-term challenges despite its strong position in the IT sectorðŸ“‰

Stay updated, visit ðŸ‘‰ http://sam-co.in/samte"
2024-10-10 04:07:20+00:00,-1001156495705,"Book 60% Profit in Godrej Industries Ltd
CMP: â‚¹ 1128
Recommended Price: â‚¹ 705    
Recommendation Date: 09-10-2023  
Duration: 1 Year
Returns: 60%

We have completed the one-year holding period with this stock under the Positional Trading Pick. According to the strategy rules, we recommend investors to sell the stock and book 60% profit. 

Name of RA: Amar Nandu

Disclaimer: https://sam-co.in/6j/"
2024-10-10 02:51:28+00:00,-1001156495705,Traders Dashboard
2024-10-09 10:29:03+00:00,-1001156495705,We are live ðŸ”´ ðŸ‘‰ https://youtube.com/live/neKlOtiObq4
2024-10-09 09:59:43+00:00,-1001156495705,
2024-10-09 09:59:22+00:00,-1001156495705,"GAEL has given a trendline breakout on the daily chart supported by rise in the trading volumes today. The stock formed a bullish engulfing candle followed by a confirmation candle today.  

Disclaimer: https://sam-co.in/6j"
2024-10-09 08:28:38+00:00,-1001156495705,"IRB Hits the Fast Lane with Yet Another Quarter of Toll Revenue GrowthðŸš§ðŸ’°

IRB Infrastructure's September 2024 toll collection saw a 19% YoY rise, with 17 projects operatingðŸ“ˆ

Stay updated, visit ðŸ‘‰  http://sam-co.in/samte"
2024-10-09 06:24:57+00:00,-1001156495705,EXIT SL HIT CMP 85
2024-10-09 05:23:31+00:00,-1001156495705,"RECOMMENDATION ALERT ðŸ””

Stock Name: NIFTY
Symbol: NIFTY24O1025150CE
Rating: Buy ðŸŸ¢
CMP: â‚¹119
Stop loss: â‚¹85
Target: 190
Duration: INTRADAY
Trade Date: 09-10-2024
Trade Type: Intraday Call
Name of RA: Dhupesh Dhameja

Disclaimer: https://sam-co.in/6j/ Samco Securities Ltd"
2024-10-09 05:11:30+00:00,-1001156495705,"RECOMMENDATION ALERT ðŸ””

Stock Name: Astrazeneca Pharma India Ltd
Symbol: ASTRAZEN
Rating: Buy ðŸŸ¢
CMP: â‚¹7940
Stop loss: â‚¹7580
Target: 8750
Duration: 5-10 Days
Trade Date: 09-10-2024
Trade Type: Short-Term Trade
Name of RA: Om Mehra

Disclaimer: https://sam-co.in/6j/ Samco Securities Ltd"
2024-10-09 04:48:51+00:00,-1001156495705,"RECOMMENDATION ALERT ðŸ””

Stock Name: Parag Milk Foods Ltd
Symbol: PARAGMILK
Rating: Buy ðŸŸ¢
CMP: â‚¹217
Stop loss: â‚¹203
Target: 245
Duration: 5-10 Days
Trade Date: 09-10-2024
Trade Type: Short-Term Trade
Name of RA: Om Mehra

Disclaimer: https://sam-co.in/6j/ Samco Securities Ltd"
2024-10-09 02:57:56+00:00,-1001156495705,Traders Dashboard
2024-10-08 09:53:25+00:00,-1001156495705,
2024-10-08 09:53:07+00:00,-1001156495705,"SAREGAMA has taken support from its previous resistance level of 580 on the daily chart. Heightened volume activity is seen since last 10 trading sessions.  

Disclaimer: https://sam-co.in/6j"
2024-10-08 09:42:59+00:00,-1001156495705,"RECOMMENDATION ALERT ðŸ””

Stock Name: FSN E-Commerce Ventures Ltd
Symbol: NYKAA
Rating: Buy ðŸŸ¢
CMP: â‚¹192
Stop loss: â‚¹182.5
Target: 218
Duration: 5-10 Days
Trade Date: 08-10-2024
Trade Type: Short-Term Trade
Name of RA: Om Mehra

Disclaimer: https://sam-co.in/6j/ Samco Securities Ltd"
2024-10-08 08:52:38+00:00,-1001156495705,"Trading Alert ðŸ“¢

Amber Enterprises surges post Cup & Handle breakout, holding strong above its breakout level. Trading above the 20-day EMA with rising volumes, bullish momentum remains intact. RSI above 60 signals further strength.

Stay updated, visit ðŸ‘‰ http://sam-co.in/samte"
2024-10-08 08:04:43+00:00,-1001156495705,Exit @45
2024-10-08 06:52:09+00:00,-1001156495705,"Sobha Ltd Experiences Sales Slowdown in Q2ðŸ“‰

Sobha Ltd experienced a decline in sales for Q2 of FY 2025, with a 45% Y-o-Y decrease and a 21% sequential decline in square footage soldðŸ”½

Stay updated, visit ðŸ‘‰ http://sam-co.in/samte"
2024-10-08 05:53:59+00:00,-1001156495705,"Seasonality Analysis: TVS MotorsðŸ“Š

TVSMOTORS has generated positive returns 90% of the time with an average return of 6.24%ðŸ”¼

Stay updated, visit ðŸ‘‰ http://sam-co.in/samte"
2024-10-08 05:32:25+00:00,-1001156495705,"RECOMMENDATION ALERT ðŸ””

Stock Name: Tech Mahindra Ltd
Symbol: TECHM24OCT1620PE
Rating: Buy ðŸŸ¢
CMP: â‚¹49
Stop loss: â‚¹42.5
Target: 62
Duration: 1-2 Days
Trade Date: 08-10-2024
Trade Type: Positional Stock Option
Name of RA: Om Mehra

Disclaimer: https://sam-co.in/6j/ Samco Securities Ltd"
2024-10-08 05:16:58+00:00,-1001156495705,"Exit Rites Ltd @ 305 (adjusted)
Returns: (-20%)

The impact of weakness in the broader market was also seen in the Rites Ltdâ€™s shares. As a consequence, the share value has dipped by 20% from our entry point, ultimately triggering our pre-established stop loss.

Investors should follow the rules set by the system, cutting losers early and letting winners run."
2024-10-08 05:11:24+00:00,-1001156495705,"Exit Vardhman Textiles Ltd @ 450
Returns: (-20%)

The impact of weakness in the broader market was also seen in the companyâ€™s shares, which led the share price to dip by 20% from our entry point, ultimately triggering our pre-established stop loss.

Investors should follow the rules set by the system, cutting losers early and letting winners run."
2024-10-08 02:51:38+00:00,-1001156495705,Traders Dashboard
2024-10-07 09:35:13+00:00,-1001156495705,"September Retail Auto Sales: Falling Growth Rates and Elevated Inventory ðŸš—

In Sept, total retail auto sales reached 17,23,330, down 8.89% from the previous month and 9.26% from the same month last year

PV dealers and OEMs are facing pressure due to high inventory levels of 80-85 days, equivalent to 7.9L vehicles worth â‚¹79k Cr

However, the festive seasons of Navratri and Diwali, along with good monsoon conditions, are expected to boost salesðŸŽ‰

Stay updated, visit ðŸ‘‰  http://sam-co.in/samte"
2024-10-07 08:37:36+00:00,-1001156495705,"Market Pullback in Nifty 50 Unlocks Investment Potential ðŸ“‰

The list presents instances from the past 10 years where the Nifty 50 declined by more than 4% in a single week, along with statistics on the corresponding 1-week, 1-month, and 3-month forward returnsðŸ“Š

Stay updated, visit ðŸ‘‰  http://sam-co.in/samte"
2024-10-07 08:28:58+00:00,-1001156495705,"Expect a Strong Comeback in Indian Markets Despite Global TensionsðŸ’ª

Indian stock markets are down by 5% from its all time high of 26,277ðŸ”½

Factors like funds moving to China from India SEBI's crackdown on derivatives trading are cited as reasons for the market decline

The prime factor touted is the recent escalation of war in the Middle East with Iran attacking Israel. TA-35 which is the benchmark index of Israel is still trading within 2.5% of its ATH. The index is up by more than 33% since Israel invaded Gaza almost a year ago.

We believe that unlike what is claimed our markets have not fallen because of the escalation but because they had run up too far too soon and stretched valuations. Healthy corrections like these are necessary to keep the bull market intact. 

We expect this blip to be temporary before the index picks up momentum and start hitting ATH soon

Disclaimer: https://sam-co.in/6j/ 

Stay updated, visit ðŸ‘‰  http://sam-co.in/samte"
2024-10-07 06:26:55+00:00,-1001156495705,"RECOMMENDATION ALERT ðŸ””

Stock Name: Blue Dart Express Ltd
Symbol: BLUEDART
Rating: Buy ðŸŸ¢
CMP: â‚¹8450
Stop loss: â‚¹8115
Target: 9300
Duration: 5-10 Days
Trade Date: 07-10-2024
Trade Type: Short-Term Trade
Name of RA: Om Mehra

Disclaimer: https://sam-co.in/6j/ Samco Securities Ltd"
2024-10-07 06:00:48+00:00,-1001156495705,"Seasonality Analysis: NTPC LtdðŸ“Š

NTPC has generated positive returns 90% of the time with an average return of 1.81%

Stay updated, visit ðŸ‘‰  http://sam-co.in/samte"
2024-10-07 05:49:34+00:00,-1001156495705,"Close Position, SL Triggered"
2024-10-07 05:19:56+00:00,-1001156495705,"Book 1% Profit in Metro Brands Ltd

CMP: â‚¹ 1231
Recommended Price: â‚¹ 1220  
Recommendation Date: 04-10-2023  
Duration: 1 Year
Returns: 0.90%

We have completed the one-year holding period with this stock under the Positional Trading Pick. According to the strategy rules, we recommend investors to sell the stock and book 1% profit.

Name of RA: Amar Nandu

Disclaimer: https://sam-co.in/6j/"
2024-10-07 05:08:24+00:00,-1001156495705,"RECOMMENDATION ALERT ðŸ””

Stock Name: NIFTY
Symbol: NIFTY24O1025100PE
Rating: Buy ðŸŸ¢
CMP: â‚¹185
Stop loss: â‚¹150
Target: 250
Duration: INTRADAY
Trade Date: 07-10-2024
Trade Type: Intraday Call
Name of RA: Dhupesh Dhameja

Disclaimer: https://sam-co.in/6j/ Samco Securities Ltd"
2024-10-07 02:45:37+00:00,-1001156495705,Traders Dashboard
2024-10-06 11:32:50+00:00,-1001156495705,
2024-10-05 05:39:56+00:00,-1001156495705,https://youtu.be/TqBlqFiwmQQ
2024-10-05 03:33:48+00:00,-1001156495705,https://youtu.be/uL9I3dQ3CIc
2024-10-04 11:01:35+00:00,-1001156495705,"Join us tomorrow at 11 a.m., where Apurva Sheth is in conversation with Dharani Dharan to address ""How to Automate Options Buying Strategies""

Don't forget to see this episode exclusively on The Right Choices with the Oracles of Dalal Street"
2024-10-04 09:01:03+00:00,-1001156495705,"RECOMMENDATION ALERT ðŸ””

Stock Name: Oracle Financial Services Software Ltd
Symbol: OFSS24OCT11000PE
Rating: Buy ðŸŸ¢
CMP: â‚¹396
Stop loss: â‚¹348
Target: 540
Duration: 1-2 Days
Trade Date: 04-10-2024
Trade Type: Positional Stock Option
Name of RA: Om Mehra

Disclaimer: https://sam-co.in/6j/ Samco Securities Ltd"
2024-10-04 07:10:47+00:00,-1001156495705,"BoB Performance Update: Growth in Business Operations, Stock Up 3%ðŸ“ˆ

As of 30th Sept'24,Global Business of Bank of Baroda grew by 10.23% YoY to â‚¹25.06 trillionðŸ”¼

Notable ~20% growth in Retail advances indicates active lending to individual customers & small businesses

Overall, the data suggests that Bank of Baroda is experiencing growth in its key business segmentsðŸ“ˆðŸ“Š

Stay updated, visit ðŸ‘‰ http://sam-co.in/samte"
2024-10-04 03:11:33+00:00,-1001156495705,Traders Dashboard
2024-10-03 10:25:07+00:00,-1001156495705,"Strong Sales Growth for 2W OEMs in Sept 2024: Bajaj Auto ShinesðŸš€

All 2W OEMs recorded double-digit sales volume growth in September 2024, with Bajaj Auto posting the highest growth at 22.2%ðŸ“ˆ

Additionally, in Q2 FY25, Bajaj Autoâ€™s sales volume grew the most among OEMs, at 17.2%ðŸ“Š

However, due to today's market-wide decline, all these stocks have fallen from their previous closeðŸ“‰

Stay updated, visit ðŸ‘‰ http://sam-co.in/samte"
2024-10-03 09:50:17+00:00,-1001156495705,"RECOMMENDATION ALERT ðŸ””

Stock Name: Tata Chemicals Ltd
Symbol: TATACHEM
Rating: Buy ðŸŸ¢
CMP: â‚¹1131
Stop loss: â‚¹1068
Target: 1210
Duration: 5-10 Days
Trade Date: 03-10-2024
Trade Type: Short-Term Trade
Name of RA: Om Mehra

Disclaimer: https://sam-co.in/6j/ Samco Securities Ltd"
2024-10-03 06:50:44+00:00,-1001156495705,"Hindustan Zinc Shines with Best H1 Mined Metal OutputðŸ˜€

Hindustan Zinc  achieved its best first-half mined metal production, with all segments showing year-on-year growth in Q2

Stay updated, visit ðŸ‘‰ http://sam-co.in/samte"
2024-10-03 06:20:33+00:00,-1001156495705,"M&M's Sales Rise 16% in Sep 2024; Shares Climb 2% On the Day of AnnouncementðŸ“ˆ

M&M sold a total of 87,839 vehicles in September 2024, marking a 16.2% YoY growth

From April 2024 to Sept 2024, its total sales volume increased by 11.1% YoY, reaching 4,42,588 vehiclesðŸ”¼

In September, the company launched the new vehicle VEERO in the LCV .5 ton segment. Also, it is set to open bookings for the Thar RoXX today as the Navratri festive season begins

